tweet_id,timestamp,source,text,rating_numerator,rating_denominator,name,tweet_favorite_count,tweet_retweet_count,dog_breed,Posted Image's URL,dog_stage
678969228704284672,2015-12-21 16:04:13,Twitter for iPhone,Meet Lola. She's a Metamorphic Chartreuse. Plays with her food. Insubordinate and churlish. Exquisite hardwood 11/10 ,11.0,10,Lola,1796,528,Labrador retriever,https://t.co/etpBNXwN7f,
678800283649069056,2015-12-21 04:52:53,Twitter for iPhone,Here's a pupper with some mean tan lines. Snazzy sweater though 12/10 ,12.0,10,,2810,1018,Labrador retriever,https://t.co/DpCSVsl6vu,pupper
678798276842360832,2015-12-21 04:44:55,Twitter for iPhone,This is Linda. She fucking hates trees. 7/10 ,7.0,10,Linda,3804,1350,Airedale,https://t.co/blaY85FIxR,
678774928607469569,2015-12-21 03:12:08,Twitter for iPhone,This is Tug. He's not required to wear the cone he just wants his voice to project more clearly. 11/10 ,11.0,10,Tug,3037,1043,Pembroke,https://t.co/Sp739Ou2qx,
678767140346941444,2015-12-21 02:41:11,Twitter for iPhone,This is Mia. She makes awful decisions. 8/10 ,8.0,10,Mia,3864,1553,,https://t.co/G6TQVgTcZz,
678764513869611008,2015-12-21 02:30:45,Twitter for iPhone,"Meet Wilson. He got caught humping the futon. He's like ""dude, help me out here"" 10/10 I'd help Wilson out ",10.0,10,Wilson,1788,544,Irish terrier,https://t.co/m6XoclB0qv,
678755239630127104,2015-12-21 01:53:54,Twitter for iPhone,This is Dash. He didn't think the water would be that cold. Damn it Dash it's December. Think a little. 10/10 ,10.0,10,Dash,7802,3741,malamute,https://t.co/NqcOwG8pxW,
678740035362037760,2015-12-21 00:53:29,Twitter for iPhone,Meet Tango. He's a large dog. Doesn't care much for personal space. Owner isn't very accepting. Tongue slip. 6/10 ,6.0,10,Tango,4099,1926,beagle,https://t.co/p2T5kGebxe,
678675843183484930,2015-12-20 20:38:24,Twitter for iPhone,Exotic pup here. Tail long af. Throat looks swollen. Might breathe fire. Exceptionally unfluffy 2/10 would still pet ,2.0,10,,3155,1680,,https://t.co/a8SqCaSo2r,
678643457146150913,2015-12-20 18:29:43,Twitter for iPhone,Meet Grizz. He just arrived. Couldn't wait until Christmas. Worried bc he saw the swastikas on the carpet. 10/10 ,10.0,10,Grizz,2250,489,Labrador retriever,https://t.co/QBGwYrT7rv,
678446151570427904,2015-12-20 05:25:42,Twitter for iPhone,Touching scene here. Really stirs up the emotions. The bond between father &amp; son. So beautiful. 10/10 for both pups ,10.0,10,,4358,1785,Staffordshire bullterrier,https://t.co/AJWJHov5gx,
678424312106393600,2015-12-20 03:58:55,Twitter for iPhone,This is Crystal. She's a shitty fireman. No sense of urgency. People could be dying Crystal. 2/10 just irresponsible ,2.0,10,Crystal,5916,2880,Maltese dog,https://t.co/rtMtjSl9pz,
678410210315247616,2015-12-20 03:02:53,Twitter for iPhone,Say hello to Jerome. He can shoot french fries out of his mouth at insane speeds. Deadly af. 10/10 ,10.0,10,Jerome,4640,2072,schipperke,https://t.co/dIy88HwrX8,
678399652199309312,2015-12-20 02:20:55,Twitter for iPhone,This made my day. 12/10 please enjoy ,12.0,10,,61794,30742,Bedlington terrier,https://t.co/VRTbo3aAcm,
678396796259975168,2015-12-20 02:09:34,Twitter for iPhone,These little fellas have opposite facial expressions. Both 12/10 ,12.0,10,,1731,478,Pembroke,https://t.co/LmThv0GWen,
678389028614488064,2015-12-20 01:38:42,Twitter for iPhone,"This is Bella. She just learned that her final grade in chem was a 92.49 
poor pupper 11/10 ",11.0,10,Bella,2044,473,miniature pinscher,https://t.co/auOoKuoveM,pupper
678380236862578688,2015-12-20 01:03:46,Twitter for iPhone,This is Crumpet. He underestimated the snow. Quickly retreating. 10/10 ,10.0,10,Crumpet,2655,1020,Samoyed,https://t.co/a0Zx5LDFZa,
678341075375947776,2015-12-19 22:28:09,Twitter for iPhone,This pupper likes tape. 12/10 ,12.0,10,,1896,612,golden retriever,https://t.co/cSp6w5GWgm,pupper
678334497360859136,2015-12-19 22:02:01,Twitter for iPhone,This is Rosie. She has a snazzy bow tie and a fin for a tail. Probably super fast underwater. Cool socks 10/10 ,10.0,10,Rosie,1427,304,Norfolk terrier,https://t.co/GO76MdGBs0,
678278586130948096,2015-12-19 18:19:51,Twitter for iPhone,Another spooky pupper here. Most definitely floating. No legs. Probably knows some dark magic. 10/10 very spooked ,10.0,10,,12531,6857,Maltese dog,https://t.co/JK8MByRzgj,pupper
678255464182861824,2015-12-19 16:47:58,Twitter for iPhone,This is Jessifer. She is a Bismoth Teriyaki. Flowers being attacked by hurricanes on bandana (rad). 9/10 stellar pup ,9.0,10,Jessifer,1726,418,Chihuahua,https://t.co/nZhmRwZzWv,
678021115718029313,2015-12-19 01:16:45,Twitter for iPhone,This is Reese. He likes holding hands. 12/10 ,12.0,10,Reese,15018,7148,miniature pinscher,https://t.co/cbLroGCbmh,
677918531514703872,2015-12-18 18:29:07,Twitter for iPhone,"""Everything looks pretty good in there. Make sure to brush your gums. Been flossing? How's school going?"" Both 10/10 ",10.0,10,,1476,463,Eskimo dog,https://t.co/lWL2IMJqLR,
677895101218201600,2015-12-18 16:56:01,Twitter for iPhone,Guys this was terrifying. Really spooked me up. We don't rate ghosts. We rate dogs. Please only send dogs... 9/10 ,9.0,10,,5275,2384,dalmatian,https://t.co/EJImi1udYb,
677716515794329600,2015-12-18 05:06:23,Twitter for iPhone,IT'S PUPPERGEDDON. Total of 144/120 ...I think ,144.0,120,,3323,1104,chow,https://t.co/ZanVtAtvIq,
677700003327029250,2015-12-18 04:00:46,Twitter for iPhone,This is Ralph. He's an interpretive dancer. 10/10 ,10.0,10,Ralph,3689,1622,Siberian husky,https://t.co/zoDdPyPFsa,
677698403548192770,2015-12-18 03:54:25,Twitter for iPhone,This is Sadie. She got her holidays confused. 9/10 damn it Sadie ,9.0,10,Sadie,1332,363,Shih-Tzu,https://t.co/fm7HxOsuPK,
677687604918272002,2015-12-18 03:11:30,Twitter for iPhone,This was Cindy's face when she heard Susan forgot the snacks for after the kid's soccer game. 11/10 ,11.0,10,,2681,950,Pembroke,https://t.co/gzkuVGRgAD,
677673981332312066,2015-12-18 02:17:22,Twitter for iPhone,Endangered triangular pup here. Could be a wizard. Caught mid-laugh. No legs. Just fluff. Probably a wizard. 9/10 ,9.0,10,,3603,1677,Maltese dog,https://t.co/GFVIHIod0Z,
677662372920729601,2015-12-18 01:31:14,Twitter for iPhone,"In honor of the new Star Wars movie. Here's Yoda pug. 12/10 pet really well, would I ",12.0,10,,2134,1101,,https://t.co/pvjdRn00XH,
677644091929329666,2015-12-18 00:18:36,Twitter for iPhone,This is a dog swinging. I really enjoyed it so I hope you all do as well. 11/10 ,11.0,10,,2040,886,Chihuahua,https://t.co/Ozo9KHTRND,
677573743309385728,2015-12-17 19:39:03,Twitter for iPhone,This is Sandy. He's sexually confused. Thinks he's a pigeon. Also an All-American cheese catcher. 10/10 so petable ,10.0,10,Sandy,2322,819,,https://t.co/Htu8plSqEu,
677565715327688705,2015-12-17 19:07:09,Twitter for iPhone,Contortionist pup here. Inside pentagram. Clearly worships Satan. Known to slowly push fragile stuff off tables 6/10 ,6.0,10,,1409,513,basset,https://t.co/EX9oR55VMe,
677557565589463040,2015-12-17 18:34:46,Twitter for iPhone,Reckless pupper here. Not even looking at road. Absolute menace. No regard for fellow pupper lives. 10/10 still cute ,10.0,10,,2665,1322,Shih-Tzu,https://t.co/96IBkOYB7j,pupper
677547928504967168,2015-12-17 17:56:29,Twitter for iPhone,Not much to say here. I just think everyone needs to see this. 12/10 ,12.0,10,,7568,4076,American Staffordshire terrier,https://t.co/AGag0hFHpe,
677530072887205888,2015-12-17 16:45:31,Twitter for iPhone,Say hello to Axel. He's a Black Chevy Pinot on wheels. 0 to 60 in 5.7 seconds (if downhill). 9/10 I call shotgun ,9.0,10,Axel,1161,250,Staffordshire bullterrier,https://t.co/DKe9DBnnHE,
677334615166730240,2015-12-17 03:48:51,Twitter for iPhone,This dog gave up mid jump. 9/10 ,9.0,10,,1477,328,Lakeland terrier,https://t.co/KmMv3Y2zI8,
677331501395156992,2015-12-17 03:36:28,Twitter for iPhone,Meet Humphrey. He's a Northern Polyp Viagra. One ear works. Face stuck like that. Always surprised. 9/10 petable af ,9.0,10,Humphrey,1189,265,beagle,https://t.co/FS7eJQM2F4,
677328882937298944,2015-12-17 03:26:04,Twitter for iPhone,This is Derek. All the dogs adore Derek. He's a great guy. 10/10 really solid pup ,10.0,10,Derek,3938,1693,kelpie,https://t.co/KgcsGNb61s,
677314812125323265,2015-12-17 02:30:09,Twitter for iPhone,"Meet Tassy &amp; Bee. Tassy is pretty chill, but Bee is convinced the Ruffles are haunted. 10/10 &amp; 11/10 respectively ",10.0,10,Tassy,1799,611,Blenheim spaniel,https://t.co/fgORpmTN9C,
677301033169788928,2015-12-17 01:35:24,Twitter for iPhone,This is Juckson. He's totally on his way to a nascar race. 5/10 for Juckson ,5.0,10,Juckson,1362,471,Japanese spaniel,https://t.co/IoLRvF0Kak,
677269281705472000,2015-12-16 23:29:14,Twitter for iPhone,This is the happiest pupper I've ever seen. 10/10 would trade lives with ,10.0,10,,2164,790,Shetland sheepdog,https://t.co/ep8ATEJwRb,pupper
677228873407442944,2015-12-16 20:48:40,Twitter for iPhone,Say hello to Chuq. He just wants to fit in. 11/10 ,11.0,10,Chuq,3837,1840,,https://t.co/hGkMCjZzn4,
677187300187611136,2015-12-16 18:03:28,Twitter for iPhone,Here we see a Byzantine Rigatoni. Very aerodynamic. No eyes. Actually not windy here they just look like that. 9/10 ,9.0,10,,2981,1033,English setter,https://t.co/gzI0m6wXRo,
676975532580409345,2015-12-16 04:01:59,Twitter for iPhone,This is Cooper. He doesn't know how cheese works. Likes the way it feels on his face. Cheeky tongue slip. 11/10 ,11.0,10,Cooper,3015,1203,malamute,https://t.co/j1zczS0lI5,
676957860086095872,2015-12-16 02:51:45,Twitter for iPhone,10/10 I'd follow this dog into battle no questions asked ,10.0,10,,2395,907,Labrador retriever,https://t.co/ngTNXYQF0L,
676949632774234114,2015-12-16 02:19:04,Twitter for iPhone,This is Tyrus. He's a Speckled Centennial Ticonderoga. Terrified of floating red ball. Nifty bandana. 8/10 v petable ,8.0,10,Tyrus,1413,448,Welsh springer spaniel,https://t.co/HqM3YhCaaa,
676948236477857792,2015-12-16 02:13:31,Twitter for iPhone,This is Karl. Karl thinks he's slick. 6/10 sneaky pup ,6.0,10,Karl,2354,980,,https://t.co/Lo4ALwjVh4,
676946864479084545,2015-12-16 02:08:04,Twitter for iPhone,This pups goal was to get all four feet as close to each other as possible. Valiant effort 12/10 ,12.0,10,,1844,426,Pekinese,https://t.co/2mXALbgBTV,
676942428000112642,2015-12-16 01:50:26,Twitter for iPhone,Who leaves the last cupcake just sitting there? 9/10 ,9.0,10,,2261,855,,https://t.co/PWMqAoEx2a,
676936541936185344,2015-12-16 01:27:03,Twitter for iPhone,Here we see a rare pouched pupper. Ample storage space. Looks alert. Jumps at random. Kicked open that door. 8/10 ,8.0,10,,13809,5515,Chesapeake Bay retriever,https://t.co/mqvaxleHRz,pupper
676897532954456065,2015-12-15 22:52:02,Twitter for iPhone,Exotic handheld dog here. Appears unathletic. Feet look deadly. Can be thrown a great distance. 5/10 might pet idk ,5.0,10,,2426,817,,https://t.co/Avq4awulqk,
676864501615042560,2015-12-15 20:40:47,Twitter for iPhone,Meet Ash. He's just a head now. Lost his body during the Third Crusade. Still in good spirits. 10/10 would pet well ,10.0,10,Ash,2294,808,Chesapeake Bay retriever,https://t.co/NJj2uP0atK,
676821958043033607,2015-12-15 17:51:44,Twitter for iPhone,Finally some constructive political change in this country. 11/10 ,11.0,10,,25124,17605,Great Pyrenees,https://t.co/mvQaETHVSb,
676819651066732545,2015-12-15 17:42:34,Twitter for iPhone,Watch out Airbud. This pupper is also good at the sports. 12/10 I'm thinking D1 ,12.0,10,,1957,741,Labrador retriever,https://t.co/1HrFdo7M0C,pupper
676811746707918848,2015-12-15 17:11:09,Twitter for iPhone,Say hello to Penny &amp; Gizmo. They are practicing their caroling. The ambition in the room is tangible. 9/10 for both ,9.0,10,Penny,1536,469,Chihuahua,https://t.co/aqBHjjh5VD,
676776431406465024,2015-12-15 14:50:49,Twitter for iPhone,"When someone yells ""cops!"" at a party and you gotta get your drunk friend out of there. 10/10 ",10.0,10,,5405,2249,,https://t.co/4rMZi5Ca1k,
676617503762681856,2015-12-15 04:19:18,Twitter for iPhone,I promise this wasn't meant to be a cuteness overload account but ermergerd look at this cozy pupper. 13/10 ,13.0,10,,3149,1108,Chihuahua,https://t.co/mpQl2rJjDh,pupper
676613908052996102,2015-12-15 04:05:01,Twitter for iPhone,This is the saddest/sweetest/best picture I've been sent. 12/10 ðŸ˜¢ðŸ¶ ,12.0,10,,1183,219,Doberman,https://t.co/vQ2Lw1BLBF,
676606785097199616,2015-12-15 03:36:42,Twitter for iPhone,*screeches for a sec and then faints* 12/10 ,12.0,10,,2039,490,malinois,https://t.co/N5QL4ySBEx,
676603393314578432,2015-12-15 03:23:14,Twitter for iPhone,This is Godzilla pupper. He had a ruff childhood &amp; now deflects that pain outward by terrorizing cities. Tragic 9/10 ,9.0,10,Godzilla,1280,440,whippet,https://t.co/g1tLGkyaxr,pupper
676588346097852417,2015-12-15 02:23:26,Twitter for iPhone,This is Bubbles. He kinda resembles a fish. Always makes eye contact with u no matter what. Sneaky tongue slip. 5/10 ,5.0,10,Bubbles,2533,896,Boston bull,https://t.co/Nrhvc5tLFT,
676582956622721024,2015-12-15 02:02:01,Twitter for iPhone,"Meet Vinnie. He's having fun while being safe. Well not a lot of fun, but definitely safe, and that's important 8/10 ",8.0,10,Vinnie,1310,312,Boston bull,https://t.co/vZYtynZZlH,
676575501977128964,2015-12-15 01:32:24,Twitter for iPhone,This pupper is very passionate about Christmas. Wanted to give the tree a hug. So cute. 8/10 ,8.0,10,,2807,1254,Yorkshire terrier,https://t.co/NsGyECJuq7,pupper
676533798876651520,2015-12-14 22:46:41,Twitter for iPhone,ITSOFLUFFAYYYYY 12/10 ,12.0,10,,2025,621,chow,https://t.co/bfw13CnuuZ,
676496375194980353,2015-12-14 20:17:59,Twitter for iPhone,Say hello to Griffin. He's upset because his costume for Halloween didn't arrive until today. 9/10 cheer up pup ,9.0,10,Griffin,1641,602,pug,https://t.co/eoBCjSFajX,
676470639084101634,2015-12-14 18:35:43,Twitter for iPhone,Three generations of pupper. 11/10 for all ,11.0,10,,12616,5224,golden retriever,https://t.co/tAmQYvzrau,pupper
676440007570247681,2015-12-14 16:34:00,Twitter for iPhone,Hope your Monday isn't too awful. Here's two baseball puppers. 11/10 for each ,11.0,10,,1863,748,Maltese dog,https://t.co/dB0H9hdZai,
676430933382295552,2015-12-14 15:57:56,Twitter for iPhone,"Meet Duke. He's an Urban Parmesan. They know he's scared of the green rubber dog. ""Why u do dis?"" thinks Duke. 10/10 ",10.0,10,Duke,1526,385,golden retriever,https://t.co/3bim9U5Idr,
676263575653122048,2015-12-14 04:52:55,Twitter for iPhone,All this pupper wanted to do was go skiing. No one told him about the El NiÃ±o. Poor pupper. 10/10 maybe next year ,10.0,10,,2243,609,toy poodle,https://t.co/fTgbq1UBR9,pupper
676237365392908289,2015-12-14 03:08:46,Twitter for iPhone,Say hello to Winston. He has no respect for the system. Much rebellion. I think that's a palm tree... nice. 8/10 ,8.0,10,Winston,1335,331,French bulldog,https://t.co/dOLQddhXLZ,
676219687039057920,2015-12-14 01:58:31,Twitter for iPhone,This is Kenneth. He's stuck in a bubble. 10/10 hang in there Kenneth ,10.0,10,Kenneth,67100,31989,whippet,https://t.co/uQt37xlYMJ,
676215927814406144,2015-12-14 01:43:35,Twitter for iPhone,This is Herm. He just wants to be like the other dogs. Sneaky tongue slip. Super fuzzy. 9/10 would cuddle firmly ,9.0,10,Herm,1881,661,,https://t.co/tg8h9lzCHv,
676191832485810177,2015-12-14 00:07:50,Twitter for iPhone,These two pups just met and have instantly bonded. Spectacular scene. Mesmerizing af. 10/10 and 7/10 for blue dog ,10.0,10,,2478,1145,Chihuahua,https://t.co/gwryaJO4tC,
676146341966438401,2015-12-13 21:07:04,Twitter for iPhone,This is Bert. He likes flowers. 10/10 ,10.0,10,Bert,2077,744,Irish water spaniel,https://t.co/lmQRrNxaQu,
676101918813499392,2015-12-13 18:10:33,Twitter for iPhone,Meet Striker. He's ready for Christmas. 11/10 ,11.0,10,Striker,3042,1284,Shih-Tzu,https://t.co/B3xxSLjQSH,
676098748976615425,2015-12-13 17:57:57,Twitter for iPhone,Extremely rare pup here. Very religious. Always praying. Too many legs. Not overwhelmingly fluffy. Won't bark. 3/10 ,3.0,10,,3279,1623,,https://t.co/REyE5YKVBb,
676089483918516224,2015-12-13 17:21:08,Twitter for iPhone,"""Yes hello I'ma just snag this here toasted bagel real quick. carry on."" 9/10 ",9.0,10,,1431,483,bull mastiff,https://t.co/Cuz0Osnekp,
675898130735476737,2015-12-13 04:40:46,Twitter for iPhone,I'm sure you've all seen this pupper. Not prepared at all for the flying disc of terror. 10/10 ,10.0,10,,1774,653,Labrador retriever,https://t.co/G0pQiFGM7O,pupper
675891555769696257,2015-12-13 04:14:39,Twitter for iPhone,This is Donny. He's summoning the demon monster Babadook. 6/10 Donny please no that won't be a good time for anyone ,6.0,10,Donny,2297,976,Italian greyhound,https://t.co/kiW6Knb7Gp,
675888385639251968,2015-12-13 04:02:03,Twitter for iPhone,Breathtaking scene. A father taking care of his newborn pup. Tugs at the heartstrings. 10/10 restores my faith ,10.0,10,,2581,1067,West Highland white terrier,https://t.co/06oZdehGEa,
675878199931371520,2015-12-13 03:21:34,Twitter for iPhone,"Ok, I'll admit this is a pretty adorable bunny hopping towards the ocean but please only send in dogs... 11/10 ",11.0,10,,4531,1570,Cardigan,https://t.co/sfsVCGIipI,
675853064436391936,2015-12-13 01:41:41,Twitter for iPhone,Here we have an entire platoon of puppers. Total score: 88/80 would pet all at once ,88.0,80,,2927,1460,Labrador retriever,https://t.co/y93p6FLvVw,
675845657354215424,2015-12-13 01:12:15,Twitter for iPhone,"This is Pepper. She's not fully comfortable riding her imaginary bike yet. 10/10 don't worry pupper, it gets easier ",10.0,10,Pepper,2477,1000,pug,https://t.co/40dj4eTsXG,pupper
675822767435051008,2015-12-12 23:41:18,Twitter for iPhone,ðŸŽ¶ HELLO FROM THE OTHER SIIIIIIIIDE ðŸŽ¶ 10/10s ,10.0,10,,1652,591,Pomeranian,https://t.co/GK2HJtkdQk,
675820929667219457,2015-12-12 23:34:00,Twitter for iPhone,Here's a handful of sleepy puppers. All look unaware of their surroundings. Lousy guard dogs. Still cute tho 11/10s ,11.0,10,,1140,260,basset,https://t.co/lyXX3v5j4s,
675798442703122432,2015-12-12 22:04:39,Twitter for iPhone,This is Bernie. He just touched a boob for the first time. 10/10 ,10.0,10,Bernie,11101,3787,beagle,https://t.co/whQKMygnK6,
675781562965868544,2015-12-12 20:57:34,Twitter for iPhone,Say hello to Buddah. He was Waldo for Halloween. 11/10 ,11.0,10,Buddah,1750,537,Maltese dog,https://t.co/DVAqAnb624,
675740360753160193,2015-12-12 18:13:51,Twitter for iPhone,Here's a pupper licking in slow motion. 12/10 please enjoy ,12.0,10,,1257,388,golden retriever,https://t.co/AUJi8ujxw9,pupper
675710890956750848,2015-12-12 16:16:45,Twitter for iPhone,This is Lenny. He was just told that he couldn't explore the fish tank. 12/10 smh all that work for nothing ,12.0,10,Lenny,2046,928,standard schnauzer,https://t.co/JWi6YrpiO1,
675706639471788032,2015-12-12 15:59:51,Twitter for iPhone,This is a Sizzlin Menorah spaniel from Brooklyn named Wylie. Lovable eyes. Chiller as hell. 10/10 and I'm out.. poof ,10.0,10,,693,106,English springer,https://t.co/7E0AiJXPmI,
675534494439489536,2015-12-12 04:35:48,Twitter for iPhone,Seriously guys?! Only send in dogs. I only rate dogs. This is a baby black bear... 11/10 ,11.0,10,,1953,470,chow,https://t.co/H7kpabTfLj,
675531475945709568,2015-12-12 04:23:49,Twitter for iPhone,This is Ellie AKA Queen Slayer of the Orbs. Very self-motivated. Great yard. Rad foliage. 10/10 would pet diligently ,10.0,10,Ellie,1276,428,Pembroke,https://t.co/c9jmg3Xtzn,
675522403582218240,2015-12-12 03:47:46,Twitter for iPhone,Meet Sammy. He's a Motorola Firefox. Hat under hoodie (must be a half-decent up and coming white rapper) 10/10 ,10.0,10,Sammy,1122,316,cocker spaniel,https://t.co/rO2zxf0OQ0,
675517828909424640,2015-12-12 03:29:35,Twitter for iPhone,12/10 stay woke ,12.0,10,,1414,507,Scottish deerhound,https://t.co/XDiQw4Akiw,
675501075957489664,2015-12-12 02:23:01,Twitter for iPhone,"I shall call him squishy and he shall be mine, and he shall be my squishy. 13/10 ",13.0,10,,18482,6485,,https://t.co/WId5lxNdPH,
675497103322386432,2015-12-12 02:07:14,Twitter for iPhone,Meet Reggie. He's going for the world record. Must concentrate. Focus up pup. 11/10 we all believe in you Reggie ,11.0,10,Reggie,3397,1443,vizsla,https://t.co/h3AWz4AzuC,
675489971617296384,2015-12-12 01:38:53,Twitter for iPhone,RT until we find this dog. Clearly a cool dog (front leg relaxed out window). Looks to be a superb driver. 10/10 ,10.0,10,,1406,672,West Highland white terrier,https://t.co/MnTrKaQ8Wn,
675483430902214656,2015-12-12 01:12:54,Twitter for iPhone,Rare shielded battle dog here. Very happy about abundance of lettuce. Painfully slow fetcher. Still petable. 5/10 ,5.0,10,,1985,1081,,https://t.co/C3tlKVq7eO,
675432746517426176,2015-12-11 21:51:30,Twitter for iPhone,Happy Friday. Here's some golden puppers. 12/10 for all ,12.0,10,,1623,627,Labrador retriever,https://t.co/wNkqAED6lG,
675372240448454658,2015-12-11 17:51:04,Twitter for iPhone,"The tail alone is 13/10. Great dog, better owner ",13.0,10,,1838,563,Chihuahua,https://t.co/IyAXinfyju,
675362609739206656,2015-12-11 17:12:48,Twitter for iPhone,This is Daisy. She loves that shoe. Still no seat belt. Super churlish. 12/10 the dogs are killing it today ,12.0,10,Daisy,1136,262,Labrador retriever,https://t.co/cZlkvgRPdn,
675354435921575936,2015-12-11 16:40:19,Twitter Web Client,Everyone needs to watch this. 13/10 ,13.0,10,,35178,18963,golden retriever,https://t.co/Bb3xnpsWBC,
675334060156301312,2015-12-11 15:19:21,Twitter for iPhone,Good morning here's a grass pupper. 12/10 ,12.0,10,,3007,1436,Pembroke,https://t.co/2d68FmWGGs,pupper
675166823650848770,2015-12-11 04:14:49,Twitter for iPhone,This is Arnold. He broke his leg saving a handicapped child from a forest fire. True hero. 10/10 inspirational dog ,10.0,10,Arnold,3920,1795,standard poodle,https://t.co/bijCeHeX4C,
675153376133427200,2015-12-11 03:21:23,Twitter for iPhone,What kind of person sends in a picture without a dog in it? 1/10 just because that's a nice table ,1.0,10,,6072,2734,,https://t.co/RDXCfk8hK0,
675149409102012420,2015-12-11 03:05:37,Twitter for iPhone,holy shit 12/10 ,12.0,10,,4037,1878,chow,https://t.co/p6O8X93bTQ,
675147105808306176,2015-12-11 02:56:28,Twitter for iPhone,When you're presenting a group project and the 4th guy tells the teacher that he did all the work. 10/10 ,10.0,10,,1026,273,golden retriever,https://t.co/f50mbB4UWS,
675146535592706048,2015-12-11 02:54:12,Twitter for iPhone,This is Coops. He's yelling at the carpet. Not very productive Coops. 7/10 ,7.0,10,Coops,1300,349,Cardigan,https://t.co/Uz52oYnHzF,
675145476954566656,2015-12-11 02:49:59,Twitter for iPhone,What an honor. 3 dogs here. Blond one is clearly a gymnast. Other two just confused. Very nifty pups. 9/10 for all ,9.0,10,,2305,1011,Labrador retriever,https://t.co/YDgstgIDGs,
675135153782571009,2015-12-11 02:08:58,Twitter for iPhone,This is Steven. He got locked outside. Damn it Steven. 5/10 nice grill tho ,5.0,10,Steven,1398,542,,https://t.co/zf7Sxxjfp3,
675113801096802304,2015-12-11 00:44:07,Twitter for iPhone,Meet Zuzu. He just graduated college. Astute pupper. Needs 2 leashes to contain him. Wasn't ready for the pic. 10/10 ,10.0,10,Zuzu,2120,877,,https://t.co/2H5SKmk0k7,pupper
675111688094527488,2015-12-11 00:35:44,Twitter for iPhone,Say hello to Oliver. He thought what was inside the pillow should be outside the pillow. Blurry since birth. 8/10 ,8.0,10,Oliver,1042,283,Labrador retriever,https://t.co/lFU9W31Fg9,
675109292475830276,2015-12-11 00:26:12,Twitter for iPhone,C'mon guys. We've been over this. We only rate dogs. This is a cow. Please only submit dogs. Thank you...... 9/10 ,9.0,10,,3006,1259,dalmatian,https://t.co/WjcELNEqN2,
675047298674663426,2015-12-10 20:19:52,Twitter for iPhone,This is a fluffy albino Bacardi Columbia mix. Excellent at the tweets. 11/10 would hug gently ,11.0,10,,1141,366,Samoyed,https://t.co/diboDRUuEI,
675015141583413248,2015-12-10 18:12:05,Twitter for iPhone,Meet Moe. He's a golden Fetty Woof. Doesn't respect the authorities. Might own a motorhome? 10/10 revolutionary pup ,10.0,10,Moe,2918,1335,golden retriever,https://t.co/JAncIdNp8G,
675006312288268288,2015-12-10 17:37:00,Twitter for iPhone,Say hello to Mollie. This pic was taken after she bet all her toys on Ronda Rousey. 10/10 hang in there pupper ,10.0,10,Mollie,1057,252,boxer,https://t.co/QMmAqA9VqO,pupper
675003128568291329,2015-12-10 17:24:21,Twitter for iPhone,Meet Laela. She's adorable. Magnificent eyes. But I don't see a seat belt. Insubordinate.. and churlish. Still 12/10 ,12.0,10,Laela,1672,517,Pembroke,https://t.co/pCGDgLkLo6,
674805413498527744,2015-12-10 04:18:42,Twitter for iPhone,"When your entire life is crumbling before you and you're trying really hard to hold your shit together.
10/10 ",10.0,10,,934,391,English springer,https://t.co/vqFkgYPCW8,
674800520222154752,2015-12-10 03:59:15,Twitter for iPhone,This is Tedders. He broke his leg saving babies from the Pompeii eruption. 11/10 where's his Purple Heart? @POTUS ,11.0,10,Tedders,3240,949,Pembroke,https://t.co/cMI2AcLm4B,
674790488185167872,2015-12-10 03:19:24,Twitter for iPhone,ER... MER... GERD 13/10 ,13.0,10,,1180,278,Labrador retriever,https://t.co/L1puJISV1a,
674788554665512960,2015-12-10 03:11:43,Twitter for iPhone,Say hello to Maggie. She's a Western Septic Downy. Pretends to be Mexican. Great hardwood flooring. 9/10 ,9.0,10,Maggie,871,230,miniature poodle,https://t.co/P3ElQ2wsjb,
674781762103414784,2015-12-10 02:44:43,Twitter for iPhone,Bedazzled pup here. Fashionable af. Super yellow. Looks hella fluffy. Webbed paws for efficient fetching. 8/10 ,8.0,10,,2169,1335,,https://t.co/ot8yMUGodj,
674774481756377088,2015-12-10 02:15:47,Twitter for iPhone,This is Superpup. His head isn't proportional to his body. Has yet to serve any justice. 11/10 maybe one day pupper ,11.0,10,Superpup,1213,532,Chihuahua,https://t.co/gxIFgg8ktm,pupper
