tweet_id,timestamp,source,text,rating_numerator,rating_denominator,name,tweet_favorite_count,tweet_retweet_count,dog_breed,Posted Image's URL,dog_stage
796865951799083009,2016-11-11 00:03:42,Twitter for iPhone,This is Tyr. He's just checking on you. Nifty af tongue slip. 12/10 would absolutely pet ,12.0,10,Tyr,8564,2198,Cardigan,https://t.co/Jgnuiyvq06,
796759840936919040,2016-11-10 17:02:03,Twitter for iPhone,Say hello to Romeo. He was just told that it's too cold for the pool. H*ckin nonsense. 11/10 would help fill up ,11.0,10,Romeo,13256,3562,American Staffordshire terrier,https://t.co/6hx7ur6sNI,
796484825502875648,2016-11-09 22:49:15,Twitter for iPhone,Here's a sleepy doggo that requested some assistance. 12/10 would carry everywhere ,12.0,10,,8472,2042,cocker spaniel,https://t.co/bvkkqOjNDV,doggo
796387464403357696,2016-11-09 16:22:22,Twitter for iPhone,This is Snicku. He's having trouble reading because he's a dog. Glasses only helped a little. Nap preferred. 12/10 would snug well ,12.0,10,Snicku,12334,4861,Pekinese,https://t.co/cVLUasbKA5,
796149749086875649,2016-11-09 00:37:46,Twitter for iPhone,This is Ruby. She just turned on the news. Officially terrified. 11/10 deep breaths Ruby ,11.0,10,Ruby,36177,16628,golden retriever,https://t.co/y5KarNXWXt,
796116448414461957,2016-11-08 22:25:27,Twitter for iPhone,I didn't believe it at first but now I can see that voter fraud is a serious h*ckin issue. 11/10 ,11.0,10,,10139,2813,Cardigan,https://t.co/7i0bDMbrVN,
796080075804475393,2016-11-08 20:00:55,Twitter for iPhone,This is Yogi. He's 98% floof. Snuggable af. 12/10 ,12.0,10,Yogi,9469,2703,chow,https://t.co/opoXKxmfFm,
796031486298386433,2016-11-08 16:47:50,Twitter for iPhone,This is Daisy. She's here to make your day better. 13/10 mission h*ckin successful ,13.0,10,Daisy,12071,4284,golden retriever,https://t.co/PbgvuD0qIL,
795464331001561088,2016-11-07 03:14:10,Twitter for iPhone,Elder doggo does a splash. Both 13/10 incredible stuff ,13.0,10,,55683,27728,golden retriever,https://t.co/gBUDjdEcqz,doggo
795400264262053889,2016-11-06 22:59:35,Twitter for iPhone,This is Brody. He's trying to make the same face as the football. 12/10 ,12.0,10,Brody,11270,3323,golden retriever,https://t.co/2H4MfOGlpQ,
795076730285391872,2016-11-06 01:33:58,Twitter for iPhone,This is Bailey. She loves going down slides but is very bad at it. Still 11/10 ,11.0,10,Bailey,18139,6288,,https://t.co/ivPWhspN3E,
794926597468000259,2016-11-05 15:37:24,Twitter for iPhone,This is Mack. He's rather h*ckin sleepy. Exceptional ears. 12/10 would boop ,12.0,10,Mack,11492,2697,toy poodle,https://t.co/XRPvTPF0VH,
794332329137291264,2016-11-04 00:15:59,Twitter for iPhone,This is Nimbus (like the cloud). He just bought this fancy af duck raincoat. Only protects one ear tho. 12/10 so h*ckin floofy ,12.0,10,Nimbus,10686,3088,Samoyed,https://t.co/SIQbb8c3AU,
794205286408003585,2016-11-03 15:51:10,Twitter for iPhone,This is Laika. She was a space pupper. The first space pupper actually. Orbited earth like a h*ckin boss. 14/10 hero af ,14.0,10,Laika,10314,3895,,https://t.co/trSjgY3h4g,pupper
793962221541933056,2016-11-02 23:45:19,Twitter for iPhone,This is Maximus. His face is stuck like that. Tragic really. Great tongue tho. 12/10 would pet firmly ,12.0,10,Maximus,18910,5711,Labrador retriever,https://t.co/xIfrsMNLBR,
793845145112371200,2016-11-02 16:00:06,Twitter for iPhone,This is Clark. He was just caught wearing pants. 13/10 game-changing af ,13.0,10,Clark,10295,2187,Old English sheepdog,https://t.co/2Xo19aPrG5,
793601777308463104,2016-11-01 23:53:02,Twitter for iPhone,This is Dobby. I can't stop looking at her feet. 12/10 would absolutely snug ,12.0,10,Dobby,8926,1908,miniature pinscher,https://t.co/LhzPWv6rTv,
793500921481273345,2016-11-01 17:12:16,Twitter for iPhone,This is Fiona. She's an extremely mediocre copilot. Very distracting. Wink makes up for all the missed turns. 12/10 ,12.0,10,Fiona,11953,2786,golden retriever,https://t.co/aF5MmpvPqN,
793286476301799424,2016-11-01 03:00:09,Twitter for iPhone,This is Moreton. He's the Good Boy Who Lived. 13/10 magical as h*ck ,13.0,10,Moreton,27597,10723,Afghan hound,https://t.co/rLHGx3VAF3,
793271401113350145,2016-11-01 02:00:14,Twitter for iPhone,Meet Dave. It's his favorite day of the year. He gets to fulfill his dream of being a dinosaur. 12/10 inspirational af ,12.0,10,Dave,9677,2763,Siberian husky,https://t.co/MgQSdfZGPN,
793256262322548741,2016-11-01 01:00:05,Twitter for iPhone,Oh h*ck look at this spookling right here. Fright level off the charts. 12/10 sufficiently spooked ,12.0,10,,22350,9714,basset,https://t.co/BNy9IIJMb0,
793241302385262592,2016-11-01 00:00:38,Twitter for iPhone,This is Tucker. He's out here bustin h*ckin ghosts. 13/10 dedicated af ,13.0,10,Tucker,11780,3812,golden retriever,https://t.co/Ap477GhwXt,
793226087023144960,2016-10-31 23:00:11,Twitter for iPhone,"This is Juno. She spooked me up real good, but only to get my attention. Above average handwriting for a dog I think. 11/10 ",11.0,10,Juno,11001,3338,wire-haired fox terrier,https://t.co/hFxxBCWlwj,
793210959003287553,2016-10-31 22:00:04,Twitter for iPhone,This is Maude. She's the h*ckin happiest wasp you've ever seen. 10/10 would pet with caution ,10.0,10,Maude,9997,3301,French bulldog,https://t.co/etL8FHBrh8,
793195938047070209,2016-10-31 21:00:23,Twitter for iPhone,Say hello to Lily. She's pupset that her costume doesn't fit as well as last year. 12/10 poor puppo ,12.0,10,Lily,17063,6547,Labrador retriever,https://t.co/YSi6K1firY,puppo
793180763617361921,2016-10-31 20:00:05,Twitter for iPhone,This is Newt. He's a strawberry. 11/10 ,11.0,10,Newt,7740,2310,Lakeland terrier,https://t.co/2VhmlwxA1Q,
793165685325201412,2016-10-31 19:00:10,Twitter for iPhone,This is Benji. He's Air Bud. It's a low effort costume but he pulls it off rather h*ckin well. 12/10 would happily get dunked on ,12.0,10,Benji,10478,3238,golden retriever,https://t.co/IbzT7DJvBo,
793150605191548928,2016-10-31 18:00:14,Twitter for iPhone,This is Nida. She's a free elf. Waited so long for this day. 11/10 ,11.0,10,Nida,6909,1984,Italian greyhound,https://t.co/3lE8Izgmkf,
793135492858580992,2016-10-31 17:00:11,Twitter for iPhone,Your favorite squad is looking extra h*ckin spooky today. 13/10 for all ,13.0,10,,7214,2893,,https://t.co/PrgvOyPtDT,
793120401413079041,2016-10-31 16:00:13,Twitter for iPhone,"This is Robin. She's desperately trying to do me a frighten, but her tongue drastically decreases her spook value. Still 11/10 great effort ",11.0,10,Robin,14202,4551,Labrador retriever,https://t.co/sxMrsOZ8zb,
792913359805018113,2016-10-31 02:17:31,Twitter for iPhone,Here is a perfect example of someone who has their priorities in order. 13/10 for both owner and Forrest ,13.0,10,,16063,4715,,https://t.co/LRyMrU7Wfq,
792883833364439040,2016-10-31 00:20:11,Twitter for iPhone,This is Bailey. She's rather h*ckin hype for Halloween tomorrow. Carved those pupkins herself. 12/10 ,12.0,10,Bailey,12666,4964,standard poodle,https://t.co/v17mFm0Ftz,
792773781206999040,2016-10-30 17:02:53,Twitter for iPhone,This is Monster. Not an actual monster tho. He's showing you his tongue. Very impressive Monster. 12/10 would snug ,12.0,10,Monster,8209,1963,Yorkshire terrier,https://t.co/RhaPExuxJL,
792394556390137856,2016-10-29 15:55:58,Twitter for iPhone,Meet BeBe. She rocks the messy bun of your dreams. H*ckin flawless. 12/10 would watch her tutorial ,12.0,10,BeBe,15128,4998,cocker spaniel,https://t.co/of0pFNBIl8,
792050063153438720,2016-10-28 17:07:05,Twitter for iPhone,This is Remus. He's a mop that came to life. Can't see anything. Constantly trips over himself. Still a very good dog. 11/10 ,11.0,10,Remus,8029,2088,komondor,https://t.co/S3f1SYylzu,
791672322847637504,2016-10-27 16:06:04,Twitter for iPhone,When she says you're a good boy and you know you're a good boy because you're a good boy. 13/10 ,13.0,10,,13129,3661,golden retriever,https://t.co/O5IUmRHRIh,
791406955684368384,2016-10-26 22:31:36,Twitter for iPhone,Say hello to Levi. He's a Madagascan Butterbop. One of the more docile Butterbops I've seen. 12/10 would give all the pets ,12.0,10,Levi,14670,4797,Pembroke,https://t.co/Zcw9Sccctc,
791312159183634433,2016-10-26 16:14:55,Twitter for iPhone,This is Mabel. She's super h*ckin smol. Portable af. Comes with the smol shoe. 12/10 would keep in frocket ,12.0,10,Mabel,9841,2963,miniature pinscher,https://t.co/GGJvxYt3xK,
790987426131050500,2016-10-25 18:44:32,Twitter for iPhone,This is Misty. She has a cowboy hat on her nose. 12/10 ,12.0,10,Misty,11089,2483,cocker spaniel,https://t.co/Eno0mypHIr,
790946055508652032,2016-10-25 16:00:09,Twitter for iPhone,This is Betty. She's assisting with the dishes. Such a good puppo. 12/10 h*ckin helpful af ,12.0,10,Betty,18601,5496,golden retriever,https://t.co/dgvTPZ9tgI,puppo
790698755171364864,2016-10-24 23:37:28,Twitter for iPhone,This is Mosby. He appears to be rather h*ckin snuggable af. 12/10 keep it up Mosby ,12.0,10,Mosby,9158,2203,Bernese mountain dog,https://t.co/IiiBq460I7,
790581949425475584,2016-10-24 15:53:19,Twitter for iPhone,This is Duke. He sneaks into the fridge sometimes. It's his safe place. 11/10 would give little jacket if necessary ,11.0,10,Duke,22473,8183,malinois,https://t.co/Fd5WFDTMH4,
790337589677002753,2016-10-23 23:42:19,Twitter for iPhone,Meet Maggie. She can hear your cells divide. 12/10 can also probably fly ,12.0,10,Maggie,8740,2167,Pembroke,https://t.co/ovE2hqXryV,
790277117346975746,2016-10-23 19:42:02,Twitter for iPhone,This is Bruce. He never backs down from a challenge. 11/10 you got this Bruce ,11.0,10,Bruce,14081,3732,Labrador retriever,https://t.co/aI7umZHIq7,
789986466051088384,2016-10-23 00:27:05,Twitter for iPhone,This is Happy. He's a bathtub reviewer. Seems to be pleased with this one. 12/10 ,12.0,10,Happy,10369,2704,golden retriever,https://t.co/Ln89R4FP7v,
789628658055020548,2016-10-22 00:45:17,Twitter for iPhone,This is Eli. He can fly. 13/10 magical af ,13.0,10,Eli,8448,2080,chow,https://t.co/huPSJJ7FDI,
789599242079838210,2016-10-21 22:48:24,Twitter for iPhone,This is Brownie. She's wearing a Halloween themed onesie. 12/10 festive af ,12.0,10,Brownie,7620,2279,Chesapeake Bay retriever,https://t.co/0R4meWXFOx,
789530877013393408,2016-10-21 18:16:44,Twitter for iPhone,This is Rizzy. She smiles a lot. 12/10 contagious af ,12.0,10,Rizzy,13188,3942,schipperke,https://t.co/TU4sZogVIq,
789268448748703744,2016-10-21 00:53:56,Twitter for iPhone,This is Stella. She's happier than I will ever be. 10/10 would trade lives with ,10.0,10,Stella,10196,3014,malamute,https://t.co/JSs2bfDtTS,
789137962068021249,2016-10-20 16:15:26,Twitter for iPhone,This is Bo. He's a West Congolese Bugaboop Snuggle. Rather exotic. Master of the head tilt. 12/10 would pay to pet ,12.0,10,Bo,10875,3244,Chihuahua,https://t.co/2jwxxtNzoN,
788908386943430656,2016-10-20 01:03:11,Twitter for iPhone,"This is Lucy. She destroyed not one, but two remotes trying to turn off the debate. 11/10 relatable af ",11.0,10,Lucy,30653,14409,golden retriever,https://t.co/3BXh073tDm,
788765914992902144,2016-10-19 15:37:03,Twitter for iPhone,This is Butter. She can have whatever she wants forever. 12/10 would hug softly ,12.0,10,Butter,30658,12014,cocker spaniel,https://t.co/x5gXRS1abq,
788412144018661376,2016-10-18 16:11:17,Twitter for iPhone,This is Dexter. He breaks hearts for a living. 11/10 h*ckin handsome af ,11.0,10,Dexter,16060,5990,golden retriever,https://t.co/4DhSsC1W7S,
788178268662984705,2016-10-18 00:41:57,Twitter for iPhone,Atlas is back and this time he's got doggles. Still 13/10 solarly conscious af ,13.0,10,,8100,2488,Samoyed,https://t.co/s7MgFWDySc,
788150585577050112,2016-10-17 22:51:57,Twitter for iPhone,This is Leo. He's a golden chow. Rather h*ckin rare. 13/10 would give extra pats ,13.0,10,Leo,6865,1510,chow,https://t.co/xosHjFzVXc,
788039637453406209,2016-10-17 15:31:05,Twitter for iPhone,Did... did they pick out that license plate? 12/10 for both ,12.0,10,,6867,1535,,https://t.co/lRmUUOxgbQ,
787810552592695296,2016-10-17 00:20:47,Twitter for iPhone,This is Frank. He wears sunglasses and walks himself. 11/10 I'll never be this cool or independent ,11.0,10,Frank,9717,3540,pug,https://t.co/pNNjBtHWPc,
787717603741622272,2016-10-16 18:11:26,Twitter for iPhone,This is Tonks. She is a service puppo. Can hear a caterpillar hiccup from 7 miles away. 13/10 would follow anywhere ,13.0,10,Tonks,11416,3240,German shepherd,https://t.co/i622ZbWkUp,puppo
787397959788929025,2016-10-15 21:01:17,Twitter for iPhone,This is Moose. He's rather h*ckin dangerous (you can tell by the collar). 11/10 would still attempt to snug ,11.0,10,Moose,12120,3300,Chihuahua,https://t.co/lHVHGdDzb3,
787322443945877504,2016-10-15 16:01:13,Twitter for iPhone,This is Lincoln. He forgot to use his blinker when he changed lanes just now. Guilty as h*ck. Still 10/10 ,10.0,10,Lincoln,8726,2032,golden retriever,https://t.co/lsrR83SiVp,
786963064373534720,2016-10-14 16:13:10,Twitter for iPhone,This is Rory. He's got an interview in a few minutes. Looking spiffy af. Nervous as h*ck tho. 12/10 would hire ,12.0,10,Rory,29725,9327,golden retriever,https://t.co/ibj5g6xaAj,
786709082849828864,2016-10-13 23:23:56,Twitter for iPhone,"This is Logan, the Chow who lived. He solemnly swears he's up to lots of good. H*ckin magical af 9.75/10 ",9.75,10,Logan,20296,7069,Pomeranian,https://t.co/yBO5wuqaPS,
786664955043049472,2016-10-13 20:28:35,Twitter for iPhone,"""Honestly Kathleen I just want more Ken Bone"" 12/10 ",12.0,10,,11957,2996,Leonberg,https://t.co/HmlEvAMP4r,
786595970293370880,2016-10-13 15:54:28,Twitter for iPhone,This is Dale. He's a real spookster. Did me quite the frighten. 11/10 not too spooky to pet tho ,11.0,10,Dale,10497,3601,Pembroke,https://t.co/L8BWDD4oBX,
786363235746385920,2016-10-13 00:29:39,Twitter for iPhone,This is Rizzo. He has many talents. A true renaissance doggo. 13/10 entertaining af ,13.0,10,Rizzo,12189,4072,golden retriever,https://t.co/TVXpEJB7Wn,doggo
786233965241827333,2016-10-12 15:55:59,Twitter for iPhone,This is Mattie. She's extremely dangerous. Will bite your h*ckin finger right off. Still 11/10 would pet with caution ,11.0,10,Mattie,17178,5571,Labrador retriever,https://t.co/78c9W8kLFh,
785927819176054784,2016-10-11 19:39:28,Twitter for iPhone,This is Lucy. She's strives to be the best potato she can be. 12/10 would boop ,12.0,10,Lucy,12696,3652,toy poodle,https://t.co/lntsj7Fc4Y,
785872687017132033,2016-10-11 16:00:24,Twitter for iPhone,Meet Rusty. He appears to be rather h*ckin fluffy. Also downright adorable af. 12/10 would rub my face against his ,12.0,10,Rusty,7489,2130,Great Pyrenees,https://t.co/1j9kLGb4wV,
785639753186217984,2016-10-11 00:34:48,Twitter for iPhone,This is Pinot. He's a sophisticated doggo. You can tell by the hat. Also pointier than your average pupper. Still 10/10 would pet cautiously ,10.0,10,Pinot,8735,2561,,https://t.co/f2wmLZTPHd,"doggo,pupper"
785533386513321988,2016-10-10 17:32:08,Twitter for iPhone,This is Dallas. Her tongue is ridiculous. 11/10 h*ckin proud af ,11.0,10,Dallas,10183,2334,miniature pinscher,https://t.co/h4jhlH4EyG,
785264754247995392,2016-10-09 23:44:41,Twitter for iPhone,This is Doc. He requested to be carried around like that. 12/10 anything for Doc ,12.0,10,Doc,8128,1911,chow,https://t.co/mWYACm4qnx,
785170936622350336,2016-10-09 17:31:53,Twitter for iPhone,This is Hero. He was enjoying the car ride until he remembered that bees are dying globally at an alarming rate. 11/10 ,11.0,10,Hero,13491,5639,Eskimo dog,https://t.co/cubFg7F4qQ,
784826020293709826,2016-10-08 18:41:19,Twitter for iPhone,This is Rusty. He's going D1 for sure. Insane vertical. 13/10 would draft ,13.0,10,Rusty,11310,3712,chow,https://t.co/AsykOwMrXQ,
784517518371221505,2016-10-07 22:15:26,Twitter for iPhone,This is Frankie. He has yet to learn how to control his tongue. 11/10 maybe one day ,11.0,10,Frankie,10039,2970,malamute,https://t.co/p6fgYe2dB6,
784431430411685888,2016-10-07 16:33:21,Twitter for iPhone,This is Stormy. He's curly af. Already pupared for Coachella next year. 12/10 ,12.0,10,Stormy,6329,1491,miniature poodle,https://t.co/PHA1vtqqpt,
783839966405230592,2016-10-06 01:23:05,Twitter for iPhone,This is Riley. His owner put a donut pillow around him and he loves it so much he won't let anyone take it off. 13/10 ,13.0,10,Riley,33689,12643,,https://t.co/8TCQcsZCZ8,
783821107061198850,2016-10-06 00:08:09,Twitter for iPhone,This is Mairi. She has mastered the art of camouflage. 12/10 h*ckin sneaky af ,12.0,10,Mairi,8209,2269,Lakeland terrier,https://t.co/STcPjiNAHp,
783695101801398276,2016-10-05 15:47:27,Twitter for iPhone,This is Loomis. He's the leader of the Kenneth search party. The passion is almost overwhelming. 12/10 one day he will be free ,12.0,10,Loomis,11650,3737,chow,https://t.co/kCRKlFg4AY,
783466772167098368,2016-10-05 00:40:09,Twitter for iPhone,This is Finn. He likes eavesdropping from filing cabinets. It's a real issue but no one has approached him about it. 11/10 would still pet ,11.0,10,Finn,9468,2608,Chihuahua,https://t.co/s8W8Del9HQ,
783391753726550016,2016-10-04 19:42:03,Twitter for iPhone,Meet Godi. He's an avid beachgoer and part time rainbow summoner. Eyeliner flawless af. 13/10 would snug well ,13.0,10,Godi,18908,6441,Norwegian elkhound,https://t.co/BO936YdJdi,
783334639985389568,2016-10-04 15:55:06,Twitter for iPhone,This is Dave. He's currently in a predicament. Doesn't seem to mind tho. 12/10 someone assist Dave ,12.0,10,Dave,32651,13616,Cardigan,https://t.co/nfprKAXqwu,
783085703974514689,2016-10-03 23:25:55,Twitter for iPhone,This is Earl. He can't catch. Did his best tho. 11/10 would repair confidence with extra pats ,11.0,10,Earl,9112,2565,Chesapeake Bay retriever,https://t.co/IsqyvbjFgM,
782969140009107456,2016-10-03 15:42:44,Twitter for iPhone,This is Cali. She arrived preassembled. Convenient af. 12/10 appears to be rather h*ckin pettable ,12.0,10,Cali,26949,8521,golden retriever,https://t.co/vOBV1ZqVcX,
782747134529531904,2016-10-03 01:00:34,Twitter for iPhone,This is Deacon. He's the happiest almost dry doggo I've ever seen. 11/10 would smile back ,11.0,10,Deacon,8310,1604,golden retriever,https://t.co/C6fUMnHt1H,doggo
782722598790725632,2016-10-02 23:23:04,Twitter for iPhone,"This is Penny. She fought a bee and the bee won. 10/10 you're fine Penny, everything's fine ",10.0,10,Penny,19250,6238,Irish setter,https://t.co/zrMVdfFej6,
782598640137187329,2016-10-02 15:10:30,Twitter for iPhone,This is Timmy. He's quite large. According to a trusted source it's actually a dog wearing a dog suit. 11/10 ,11.0,10,Timmy,8694,2184,malamute,https://t.co/BIUchFwHqn,
782305867769217024,2016-10-01 19:47:08,Twitter for iPhone,This is Sampson. He just graduated. Ready to be a doggo now. Time for the real world. 12/10 have fun with taxes ,12.0,10,Sampson,18630,6470,briard,https://t.co/pgVKxRw0s1,doggo
781955203444699136,2016-09-30 20:33:43,Twitter for iPhone,This is Chipson. He weighed in at .3 ounces and is officially super h*ckin smol. Space-saving af. 11/10 would snug delicately ,11.0,10,Chipson,12357,3920,,https://t.co/FjEsk7A1JV,
781661882474196992,2016-09-30 01:08:10,Twitter for iPhone,Who keeps sending in pictures without dogs in them? This needs to stop. 5/10 for the mediocre road ,5.0,10,,11634,3129,Pembroke,https://t.co/ELqelxWMrC,
781524693396357120,2016-09-29 16:03:01,Twitter for iPhone,Idk why this keeps happening. We only rate dogs. Not Bangladeshi Couch Chipmunks. Please only send dogs... 12/10 ,12.0,10,,23163,6426,Chesapeake Bay retriever,https://t.co/ya7bviQUUf,
781251288990355457,2016-09-28 21:56:36,Twitter for iPhone,This is Oakley. He just got yelled at for going 46 in a 45. Churlish af. 11/10 would still pet so well ,11.0,10,Oakley,9428,2458,Mexican hairless,https://t.co/xIYsa6LPA4,
781163403222056960,2016-09-28 16:07:23,Twitter for iPhone,"We normally don't rate lobsters, but this one appears to be a really good lobster. 10/10 would pet with caution ",10.0,10,,10895,3168,Shetland sheepdog,https://t.co/YkHc7U7uUy,
780931614150983680,2016-09-28 00:46:20,Twitter for iPhone,I want to finally rate this iconic puppo who thinks the parade is all for him. 13/10 would absolutely attend ,13.0,10,,24192,8536,,https://t.co/5dUYOu4b8d,puppo
780858289093574656,2016-09-27 19:54:58,Twitter for iPhone,"This is Dash. He's very stylish, but also incredibly unimpressed with the current state of our nation. 10/10 would pet ears first ",10.0,10,Dash,8033,2328,Chesapeake Bay retriever,https://t.co/YElO4hvXI6,
780800785462489090,2016-09-27 16:06:28,Twitter for iPhone,This is Koda. He has a weird relationship with tall grass. Slightly concerning. 11/10 would def still pet ,11.0,10,Koda,6141,1505,Siberian husky,https://t.co/KQzSR8eCsw,
780601303617732608,2016-09-27 02:53:48,Twitter for iPhone,Meet Hercules. He can have whatever he wants for the rest of eternity. 12/10 would snug passionately ,12.0,10,Hercules,13525,3839,Saint Bernard,https://t.co/mH0IOyFdIG,
780543529827336192,2016-09-26 23:04:13,Twitter for iPhone,Here's a perturbed super floof. 12/10 would snug so damn well ,12.0,10,,7040,2032,golden retriever,https://t.co/VG095mi09Q,
780459368902959104,2016-09-26 17:29:48,Twitter for iPhone,"This is Bear. Don't worry, he's not a real bear tho. Contains unreal amounts of squish. 11/10 heteroskedastic af ",11.0,10,Bear,5892,1224,Great Dane,https://t.co/coi4l1T2Sm,
780192070812196864,2016-09-25 23:47:39,Twitter for iPhone,We only rate dogs. Pls stop sending in non-canines like this Urban Floof Giraffe. I can't handle this. 11/10 ,11.0,10,,9712,2589,vizsla,https://t.co/zHIqpM5Gni,
779834332596887552,2016-09-25 00:06:08,Twitter for iPhone,This is Scout. He really wants to kiss himself. H*ckin inappropriate. 11/10 narcissistic af ,11.0,10,Scout,21252,8237,golden retriever,https://t.co/x0gV2Ck3AD,
779377524342161408,2016-09-23 17:50:56,Twitter for iPhone,Have you ever seen such a smol pupper? Portable af. 12/10 would keep in shirt pocket ,12.0,10,,9831,3613,,https://t.co/KsqaIzlQ12,pupper
779123168116150273,2016-09-23 01:00:13,Twitter for iPhone,This is Reggie. He hugs everyone he meets. 12/10 keep spreading the love Reggie ,12.0,10,Reggie,13206,4207,toy poodle,https://t.co/uMfhduaate,
779056095788752897,2016-09-22 20:33:42,Twitter for iPhone,Everybody drop what you're doing and look at this dog. 13/10 must be super h*ckin rare ,13.0,10,,16500,5247,Chihuahua,https://t.co/I1bJUzUEW5,
778990705243029504,2016-09-22 16:13:51,Twitter for iPhone,This is Jay. He's really h*ckin happy about the start of fall. Sneaky tongue slip in 2nd pic. 11/10 snuggly af ,11.0,10,Jay,22342,8437,cocker spaniel,https://t.co/vyx1X5eyWI,
778748913645780993,2016-09-22 00:13:04,Twitter for iPhone,"This is Mya (pronounced ""mmmyah?""). Her head is round af. 11/10 would pat accordingly ",11.0,10,Mya,7717,1562,Staffordshire bullterrier,https://t.co/1dpEuALnY0,
778650543019483137,2016-09-21 17:42:10,Twitter for iPhone,"Meet Strider. He thinks he's a sorority girl. Already wants to go to NYC for a weekend to say he's ""studied abroad"" 10/10 ",10.0,10,Strider,6430,1729,German shepherd,https://t.co/KYZkPuiC1l,
778624900596654080,2016-09-21 16:00:17,Twitter for iPhone,This is Penny. She's a sailor pup. 11/10 would take to the open seas with ,11.0,10,Penny,5177,1176,Airedale,https://t.co/0rRxyBQt32,
778408200802557953,2016-09-21 01:39:11,Twitter for iPhone,RIP Loki. Thank you for the good times. You will be missed by many. 14/10 ,14.0,10,,15135,5023,Pembroke,https://t.co/gJKD9pst5A,
778383385161035776,2016-09-21 00:00:35,Twitter for iPhone,This is Nala. She's a future Dogue model. Won't respond to my texts. 13/10 would be an honor to pet ,13.0,10,Nala,6515,1271,collie,https://t.co/zP1IvAATWv,
778286810187399168,2016-09-20 17:36:50,Twitter for iPhone,This is Stanley. He has too much skin. Isn't happy about it. Quite pupset actually. Still 11/10 would comfort ,11.0,10,Stanley,11576,3836,Boston bull,https://t.co/hhTfnPrWfb,
778039087836069888,2016-09-20 01:12:28,Twitter for iPhone,Evolution of a pupper yawn featuring Max. 12/10 groundbreaking stuff ,12.0,10,,9417,3065,German shepherd,https://t.co/t8Y4x9DmVD,pupper
778027034220126208,2016-09-20 00:24:34,Twitter for iPhone,This is Sophie. She's a Jubilant Bush Pupper. Super h*ckin rare. Appears at random just to smile at the locals. 11.27/10 would smile back ,11.27,10,Sophie,7320,1885,clumber,https://t.co/QFaUiIHxHq,pupper
777885040357281792,2016-09-19 15:00:20,Twitter for iPhone,This is Wesley. He's clearly trespassing. Seems rather h*ckin violent too. Weaponized forehead. 3/10 wouldn't let in ,3.0,10,Wesley,7078,1893,Afghan hound,https://t.co/pL7wbMRW7M,
777684233540206592,2016-09-19 01:42:24,Twitter for iPhone,"""Yep... just as I suspected. You're not flossing."" 12/10 and 11/10 for the pup not flossing ",12.0,10,,12518,3403,cocker spaniel,https://t.co/SuXcI9B7pQ,
777621514455814149,2016-09-18 21:33:11,Twitter for iPhone,This is Derek. You can't look at him and not smile. Must've just had a blue pupsicle. 12/10 would snug intensely ,12.0,10,Derek,9742,2910,chow,https://t.co/BnVTMtUeI3,
777189768882946048,2016-09-17 16:57:35,Twitter for iPhone,This is Jeffrey. He's being held so he doesn't fly away. 12/10 would set free ,12.0,10,Jeffrey,15921,4999,Chihuahua,https://t.co/d3aLyCykn7,
776813020089548800,2016-09-16 16:00:31,Twitter for iPhone,Meet Solomon. He was arrested for possession of adorable and attempted extra pats on the head. 12/10 would post bail ,12.0,10,Solomon,5444,1405,toy poodle,https://t.co/nFqLaOLUQA,
776477788987613185,2016-09-15 17:48:25,Twitter for iPhone,This is Huck. He's addicted to caffeine. Hope it's not too latte to seek help. 11/10 stay strong pupper ,11.0,10,Huck,9858,3249,Labrador retriever,https://t.co/iJE3F0VozW,pupper
