tweet_id,timestamp,source,text,rating_numerator,rating_denominator,name,tweet_favorite_count,tweet_retweet_count,dog_breed,Posted Image's URL,dog_stage
717421804990701568,2016-04-05 18:41:02,Twitter for iPhone,This is Ebby. She's a Zimbabwean Feta. Embarrassed by ridiculously squishy face. 9/10 would squeeze softly ,9.0,10,Ebby,3446,945,miniature pinscher,https://t.co/LBJqxMGaHi,
717047459982213120,2016-04-04 17:53:31,Twitter for iPhone,This is FlÃ¡vio (pronounced Baxter). He's a Benesnoop Cumberdog. Super rare. Symmetrical. 12/10 would pet so well ,12.0,10,FlÃ¡vio,6826,2135,golden retriever,https://t.co/fGgleFiBPq,
717009362452090881,2016-04-04 15:22:08,Twitter for iPhone,This is Smokey. He's having some sort of existential crisis. 10/10 hang in there pupper ,10.0,10,Smokey,3583,1102,Siberian husky,https://t.co/JmgF4dMpw0,pupper
716802964044845056,2016-04-04 01:41:58,Twitter for iPhone,This is Link. He struggles with couches. 10/10 would assist ,10.0,10,Link,4627,1317,malinois,https://t.co/SbX4e6Yg3o,
716791146589110272,2016-04-04 00:55:01,Twitter for iPhone,Meet Jennifur. She's supposed to be navigating. Not even buckled up. Insubordinate &amp; churlish. 11/10 would still pet ,11.0,10,Jennifur,5204,1474,Pomeranian,https://t.co/h0trcJohYO,
716439118184652801,2016-04-03 01:36:11,Twitter for iPhone,This is Bluebert. He just saw that both #FinalFur match ups are split 50/50. Amazed af. 11/10 ,50.0,50,Bluebert,2574,247,Siberian husky,https://t.co/Kky1DPG4iq,
716285507865542656,2016-04-02 15:25:47,Twitter for iPhone,This is Stephanus. She stays woke. 12/10 ,12.0,10,Stephanus,3041,1225,Yorkshire terrier,https://t.co/WIWabMngQZ,
716080869887381504,2016-04-02 01:52:38,Twitter for iPhone,Here's a super majestic doggo and a sunset 11/10 ,11.0,10,,5272,1935,golden retriever,https://t.co/UACnoyi8zu,doggo
715928423106027520,2016-04-01 15:46:52,Twitter for iPhone,This is Bubbles. He's a Yorkshire Piccolope. 11/10 would snug aggressively ,11.0,10,Bubbles,3485,987,pug,https://t.co/3BhMojONxq,
715733265223708672,2016-04-01 02:51:22,Twitter for iPhone,This is a taco. We only rate dogs. Please only send in dogs. Dogs are what we rate. Not tacos. Thank you... 10/10 ,10.0,10,,5093,1920,Dandie Dinmont,https://t.co/cxl6xGY8B9,
715696743237730304,2016-04-01 00:26:15,Twitter for iPhone,Meet Toby. He's a Lithuanian High-Steppin Stickeroo. One of the more accomplished Stickeroos around. 10/10 so nifty ,10.0,10,Toby,4257,1454,Staffordshire bullterrier,https://t.co/cYPHuJYTjC,
715680795826982913,2016-03-31 23:22:53,Twitter for iPhone,This is Zeus. He's downright fabulous. 12/10 ,12.0,10,Zeus,4719,1813,golden retriever,https://t.co/sSugyyRuTp,
715360349751484417,2016-03-31 02:09:32,Twitter for iPhone,This is Bertson. He just wants to say hi. 11/10 would boop nose ,11.0,10,Bertson,5955,1772,,https://t.co/hwv7Wq6gDA,
715342466308784130,2016-03-31 00:58:29,Twitter for iPhone,This is Oscar. He's a world renowned snowball inspector. It's a ruff job but someone has to do it. 10/10 great guy ,10.0,10,Oscar,3294,768,West Highland white terrier,https://t.co/vSufMAKm3C,
715220193576927233,2016-03-30 16:52:36,Twitter for iPhone,This is Nico. His selfie game is strong af. Excellent use of a sneaky tongue slip. 10/10 star material ,10.0,10,Nico,2630,736,Chihuahua,https://t.co/1OBdJkMOFx,
715200624753819648,2016-03-30 15:34:51,Twitter for iPhone,This is Michelangelope. He's half coffee cup. Rare af. 12/10 would hug until someone stopped me ,12.0,10,Michelangelope,5578,2110,Chihuahua,https://t.co/tvVDY0G911,
715009755312439296,2016-03-30 02:56:24,Twitter for iPhone,This is Siba. She's remarkably mobile. Very sleepy as well. 12/10 would happily transport ,12.0,10,Siba,4550,1392,Chihuahua,https://t.co/TjnI33RE1i,
714982300363173890,2016-03-30 01:07:18,Twitter for iPhone,This is Calbert. He forgot to clear his Google search history. 9/10 rookie mistake Calbert ,9.0,10,Calbert,4094,1166,Brittany spaniel,https://t.co/jRm5J3YCmj,
714957620017307648,2016-03-29 23:29:14,Twitter for iPhone,This is Curtis. He's an Albino Haberdasher. Terrified of dandelions. They really spook him up. 10/10 it'll be ok pup ,10.0,10,Curtis,4503,1595,Great Pyrenees,https://t.co/s8YcfZrWhK,
714631576617938945,2016-03-29 01:53:39,Twitter for iPhone,This is Benedict. He's a feisty pup. Needs a brushing. Portable af. Looks very angry actually. 4/10 might not pet ,4.0,10,Benedict,3571,1122,,https://t.co/3oeFfHjv0Z,
714606013974974464,2016-03-29 00:12:05,Twitter for iPhone,Here are two lil cuddly puppers. Both 12/10 would snug like so much ,12.0,10,,3938,1038,Norfolk terrier,https://t.co/zO4eb7C4tG,
714258258790387713,2016-03-28 01:10:13,Twitter for iPhone,"Meet Travis and Flurp. Travis is pretty chill but Flurp can't lie down properly. 10/10 &amp; 8/10
get it together Flurp ",10.0,10,Travis,3281,808,collie,https://t.co/Akzl5ynMmE,
714251586676113411,2016-03-28 00:43:43,Twitter for iPhone,This is Thumas. He hates potted plants. 8/10 wtf Thumas ,8.0,10,Thumas,3570,940,soft-coated wheaten terrier,https://t.co/rDVueNIcEi,
714214115368108032,2016-03-27 22:14:49,Twitter for iPhone,Happy Easter from the squad! ðŸ‡ðŸ¶ 13/10 for all ,13.0,10,,2480,990,pug,https://t.co/YMx4KWJUAB,
714141408463036416,2016-03-27 17:25:54,Twitter for iPhone,"I know we only rate dogs, but since it's Easter I guess we could rate a bunny for a change. 10/10 petable as hell ",10.0,10,,4673,1569,Labrador retriever,https://t.co/O2RlKXigHu,
713919462244790272,2016-03-27 02:43:58,Twitter for iPhone,This is Kanu. He's a Freckled Ticonderoga. Simply flawless. 12/10 would perform an elaborate heist to capture ,12.0,10,Kanu,3564,869,Siberian husky,https://t.co/7vyAzIURrE,
713900603437621249,2016-03-27 01:29:02,Twitter for iPhone,Happy Saturday here's 9 puppers on a bench. 99/90 good work everybody ,99.0,90,,3062,829,golden retriever,https://t.co/mpvaVxKmc1,
713761197720473600,2016-03-26 16:15:05,Twitter for iPhone,This is Piper. She would really like that tennis ball core. Super sneaky tongue slip. 12/10 precious af ,12.0,10,Piper,5308,1541,Brittany spaniel,https://t.co/QP6GHi5az9,
713411074226274305,2016-03-25 17:03:49,Twitter for iPhone,Here we see an extremely rare Bearded Floofmallow. Only a few left in the wild. 11/10 would pet with a purpose ,11.0,10,,4802,1440,Great Pyrenees,https://t.co/jVJJKlPbvq,
713177543487135744,2016-03-25 01:35:51,Twitter for iPhone,This is Lance. Lance doesn't give a shit. 10/10 we should all be more like Lance ,10.0,10,Lance,7854,3183,whippet,https://t.co/SqnG9Ap28J,
713175907180089344,2016-03-25 01:29:21,Twitter for iPhone,Say hello to Opie and Clarkus. Clarkus fell asleep so Opie buried him. Ruthless af 10/10 for both ,10.0,10,Opie,4851,1630,malamute,https://t.co/xT7XaY4gnW,
712809025985978368,2016-03-24 01:11:29,Twitter for iPhone,This is Stubert. He just arrived. 10/10 ,10.0,10,Stubert,20378,7602,Labrador retriever,https://t.co/HVGs5aAKAn,
712717840512598017,2016-03-23 19:09:09,Twitter for iPhone,Please don't send in any more polar bears. We only rate dogs. Thank you... 10/10 ,10.0,10,,13474,5616,Great Pyrenees,https://t.co/83RGhdIQz2,
712668654853337088,2016-03-23 15:53:42,Twitter for iPhone,Say hello to Sunny and Roxy. They pull things out of water together. 10/10 for both ,10.0,10,Sunny,4531,1367,Labrador retriever,https://t.co/88aedAmxcl,
712438159032893441,2016-03-23 00:37:48,Twitter for iPhone,This is Kane. He's a semi-submerged Haitian Huffleplop. Happy af. Sick waterfall. 11/10 would pat head approvingly ,11.0,10,Kane,5799,1756,Great Pyrenees,https://t.co/7zjEC501Ul,
712097430750289920,2016-03-22 02:03:52,Twitter for iPhone,I can't even comprehend how confused this dog must be right now. 10/10 ,10.0,10,,4144,1172,Labrador retriever,https://t.co/8AGcQ4hIfK,
712092745624633345,2016-03-22 01:45:15,Twitter for iPhone,This is Steven. He's inverted af. Also very helpful. Scans anything you want for free. Takes him a while tho. 7/10 ,7.0,10,Steven,3211,1016,,https://t.co/tA0ZiQ7JcG,
712085617388212225,2016-03-22 01:16:55,Twitter for iPhone,"Say hello to Olive and Ruby. They are best buddies. Both 11/10 
1 like = 1 buddy ",11.0,10,Olive,3531,556,Shih-Tzu,https://t.co/yagmFdKlyL,
712065007010385924,2016-03-21 23:55:01,Twitter for iPhone,This is Chester. He's clearly in charge of the other dogs. Weird ass paws. Not fit for fetch. 6/10 would still pet ,6.0,10,Chester,2451,700,,https://t.co/o2GvskrhHt,
711968124745228288,2016-03-21 17:30:03,Twitter for iPhone,Meet Winston. He's trapped in a cup of coffee. Poor pupper. 10/10 someone free him ,10.0,10,Winston,8776,2601,,https://t.co/2e6cUtKUuc,pupper
711743778164514816,2016-03-21 02:38:34,Twitter for iPhone,Meet Roosevelt. He's calculating the best case scenario if he drops out instead of doing math hw. 11/10 relatable af ,11.0,10,Roosevelt,3095,1101,Lakeland terrier,https://t.co/QcSIRDpfVg,
711732680602345472,2016-03-21 01:54:29,Twitter for iPhone,I want to hear the joke this dog was just told. 10/10 ,10.0,10,,9756,4653,Ibizan hound,https://t.co/1KiuZqqOD4,
711694788429553666,2016-03-20 23:23:54,Twitter for iPhone,Oh. My. God. 13/10 magical af ,13.0,10,,35865,20500,,https://t.co/Ezu6jQrKAZ,
711652651650457602,2016-03-20 20:36:28,Twitter for iPhone,This is Gary. He just wanted to say hi. 9/10 very personable pup ,9.0,10,Gary,4228,1037,,https://t.co/Sk3CbhmKSW,
711363825979756544,2016-03-20 01:28:47,Twitter for iPhone,"""Please, no puparazzi"" 11/10 ",11.0,10,,3996,1287,Pembroke,https://t.co/nJIXSPfedK,
711306686208872448,2016-03-19 21:41:44,Twitter for iPhone,What hooligan sent in pictures w/out a dog in them? Churlish af. 3/10 just bc that's a neat fluffy bean bag chair ,3.0,10,,3596,819,Dandie Dinmont,https://t.co/wcwoGOkZvz,
711008018775851008,2016-03-19 01:54:56,Twitter for iPhone,This is Chuckles. He had a balloon but he accidentally let go of it and it floated away. 11/10 hang in there pupper ,11.0,10,Chuckles,3275,710,French bulldog,https://t.co/68iNM7B5gW,pupper
710997087345876993,2016-03-19 01:11:29,Twitter for iPhone,Meet Milo and Amos. They are the best of pals. Both 12/10 would pet at the same time ,12.0,10,Milo,4960,1561,malamute,https://t.co/Mv37BHEyyD,
710844581445812225,2016-03-18 15:05:29,Twitter for iPhone,This is Staniel. His selfie game is strong af. 10/10 I'd snapchat with Staniel ,10.0,10,Staniel,2775,779,Pembroke,https://t.co/UgkTw7TKyM,
710833117892898816,2016-03-18 14:19:56,Twitter for iPhone,Say hello to Sora. She's an Egyptian Pumpernickel. Mesmerizing af. 12/10 would bring home to mom ,12.0,10,Sora,2937,606,Pembroke,https://t.co/PmTR4kxZkq,
710658690886586372,2016-03-18 02:46:49,Twitter for iPhone,Here's a brigade of puppers. All look very prepared for whatever happens next. 80/80 ,80.0,80,,2529,636,soft-coated wheaten terrier,https://t.co/0eb7R1Om12,
710588934686908417,2016-03-17 22:09:38,Twitter for iPhone,This is Beemo. He's a Chubberflop mix. 12/10 would cross the world for ,12.0,10,Beemo,4968,2107,Pembroke,https://t.co/kzMVMU8HBV,
710283270106132480,2016-03-17 01:55:02,Twitter for iPhone,This is Gunner. He's a Figamus Newton. King of the peek-a-boo. Cool jeans. 11/10 ,11.0,10,Gunner,2308,580,Shih-Tzu,https://t.co/ONuBILIYXZ,
710272297844797440,2016-03-17 01:11:26,Twitter for iPhone,We ðŸ‘ðŸ» only ðŸ‘ðŸ» rate ðŸ‘ðŸ» dogs. Pls stop sending in non-canines like this Dutch Panda Worm. This is infuriating. 11/10 ,11.0,10,,4945,1425,Old English sheepdog,https://t.co/odfLzBonG2,
710269109699739648,2016-03-17 00:58:46,Twitter for iPhone,"The squad is back for St. Patrick's Day! â˜˜ ðŸ’š
13/10 for all ",13.0,10,,2613,1257,pug,https://t.co/OcCDb2bng5,
710153181850935296,2016-03-16 17:18:07,Twitter for iPhone,This is Lacy. She's tipping her hat to you. Daydreams of her life back on the frontier. 11/10 would pet so well ,11.0,10,Lacy,3153,1006,cocker spaniel,https://t.co/fG5Pk3Et1I,
710140971284037632,2016-03-16 16:29:35,Twitter for iPhone,This is Tater. His underbite is fierce af. Doesn't give a damn about your engagement photo. 8/10 ,8.0,10,Tater,3017,1008,Pekinese,https://t.co/nLuPY3pY12,
710117014656950272,2016-03-16 14:54:24,Twitter for iPhone,This pupper got her hair chalked for her birthday. Hasn't told her parents yet. Rebellious af. 11/10 very nifty ,11.0,10,,5999,2233,toy poodle,https://t.co/h1OX2mLtxV,pupper
709918798883774466,2016-03-16 01:46:45,Twitter for iPhone,Meet Watson. He's a Suzuki Tickleboop. Leader of a notorious biker gang. Only one ear functional. 12/10 snuggable af ,12.0,10,Watson,3250,1215,Pembroke,https://t.co/R1gLc5vDqG,
709901256215666688,2016-03-16 00:37:03,Twitter for iPhone,"WeRateDogs stickers are here and they're 12/10! Use code ""puppers"" at checkout ðŸ¶ðŸ¾

Shop now: ",12.0,10,,732,112,,https://t.co/k5xsufRKYm,
709852847387627521,2016-03-15 21:24:41,Twitter for iPhone,*lets out a tiny whimper and then collapses* ...12/10 ,12.0,10,,3824,1336,Chihuahua,https://t.co/BNdVZEHRow,
709566166965075968,2016-03-15 02:25:31,Twitter for iPhone,This is Olaf. He's gotta be rare. Seems sturdy. Tail is floofy af. 12/10 would do whatever it takes to pet ,12.0,10,Olaf,3865,1367,chow,https://t.co/E9jaU59bh9,
709556954897764353,2016-03-15 01:48:55,Twitter for iPhone,This is Cecil. She's a Gigglefloof Poofer. Outdoorsy af. One with nature. 12/10 would strategically capture ,12.0,10,Cecil,3593,1204,golden retriever,https://t.co/ijJB0DuOIC,
709519240576036864,2016-03-14 23:19:03,Twitter for iPhone,This is Vince. He's a Gregorian Flapjeck. White spot on legs almost looks like another dog (whoa). 9/10 rad as hell ,9.0,10,Vince,1620,277,cocker spaniel,https://t.co/aczGAV2dK4,
709449600415961088,2016-03-14 18:42:20,Twitter for iPhone,Meet Karma. She's just a head. Lost body during the Second Punic War (unfortunate). Loves to travel 10/10 petable af ,10.0,10,Karma,2420,665,Maltese dog,https://t.co/c6af6nYEPo,
709409458133323776,2016-03-14 16:02:49,Twitter for iPhone,This is Billy. He sensed a squirrel. 8/10 damn it Billy ,8.0,10,Billy,2855,788,Shetland sheepdog,https://t.co/Yu0K98VZ9A,
709225125749587968,2016-03-14 03:50:21,Twitter for iPhone,This is Walker. He's a Butternut Khalifa. Appears fuzzy af. 11/10 would hug for a ridiculous amount of time ,11.0,10,Walker,2615,647,Labrador retriever,https://t.co/k6fEWHSALn,
709207347839836162,2016-03-14 02:39:42,Twitter for iPhone,This is Penny. She's trying on her prom dress. Stunning af 11/10 ,11.0,10,Penny,13755,6567,Chihuahua,https://t.co/qcZDZGCapg,
709198395643068416,2016-03-14 02:04:08,Twitter for iPhone,"From left to right:
Cletus, Jerome, Alejandro, Burp, &amp; Titson
None know where camera is. 45/50 would hug all at once ",45.0,50,,2634,721,borzoi,https://t.co/sedre1ivTK,
709158332880297985,2016-03-13 23:24:56,Twitter for iPhone,Meet Rodney. He's a Ukranian Boomchicka. Outside but would like to be inside. Only has one ear (unfortunate) 10/10 ,10.0,10,Rodney,2236,470,Siberian husky,https://t.co/FjAj3ggXrR,
709042156699303936,2016-03-13 15:43:18,Twitter for iPhone,This is Klevin. He's addicted to sandwiches (yes a hotdog is a sandwich fight me) It's tearing his family apart 9/10 ,9.0,10,Klevin,5197,1864,Rottweiler,https://t.co/7BkkVNu5pd,
708845821941387268,2016-03-13 02:43:08,Twitter for iPhone,Here's a pupper with magic eyes. Not wearing a seat belt tho (irresponsible af). Very distracting to driver. 9/10 ,9.0,10,,3226,1015,schipperke,https://t.co/5DLJB4ssvI,pupper
708834316713893888,2016-03-13 01:57:25,Twitter for iPhone,Meet Malikai. He was rolling around having fun when he remembered the inevitable heat death of the universe. 10/10 ,10.0,10,Malikai,1860,571,Eskimo dog,https://t.co/Vd2FqHIIGn,
708810915978854401,2016-03-13 00:24:26,Twitter for iPhone,This is Mister. He's a wonderful father to his two pups. Heartwarming af. 10/10 for all ,10.0,10,Mister,18036,7848,golden retriever,https://t.co/2KcuJXL2r4,
708738143638450176,2016-03-12 19:35:15,Twitter for iPhone,This is Coco. She gets to stay on the Bachelor for another week. Super pumped 11/10 ,11.0,10,Coco,2997,917,Pomeranian,https://t.co/wsCB6LFNxD,
708711088997666817,2016-03-12 17:47:45,Twitter for iPhone,This is Smokey. He really likes tennis balls. 11/10 ,11.0,10,Smokey,2790,834,German short-haired pointer,https://t.co/Ah7WlYTUBQ,
708479650088034305,2016-03-12 02:28:06,Twitter for iPhone,Meet Bear. He's a Beneboop Cumberclap. Extremely unamused. 13/10 I'm in love with this picture ,13.0,10,Bear,2768,765,Shih-Tzu,https://t.co/uC8kUqAz0W,
708469915515297792,2016-03-12 01:49:25,Twitter for iPhone,This is Bobble. He's a Croatian Galifianakis. Hears everything within 400 miles. 11/10 would snug diligently ,11.0,10,Bobble,3357,926,Chihuahua,https://t.co/VwDc6PTDzk,
708356463048204288,2016-03-11 18:18:36,Twitter for iPhone,This is Oliver. That is his castle. He protects it with his life. He's also squishy af. 10/10 would squish softly ,10.0,10,Oliver,3929,1520,pug,https://t.co/oSuEGw0BhX,
708349470027751425,2016-03-11 17:50:48,Twitter for iPhone,This is River. He's changing the trumpet game. Innovative af. 11/10 such a good boy ,11.0,10,River,2568,831,basenji,https://t.co/tK7a0AxQfd,
708149363256774660,2016-03-11 04:35:39,Twitter for iPhone,This is Jebberson. He's the reigning hide and seek world champion. 10/10 hasn't lost his touch ,10.0,10,Jebberson,4672,1727,Cardigan,https://t.co/VEFkvWCoHF,
708130923141795840,2016-03-11 03:22:23,Twitter for iPhone,Please stop sending in non canines like this Guatemalan Twiggle Bunny. We only rate dogs. Only send in dogs... 11/10 ,11.0,10,,3707,943,French bulldog,https://t.co/XKhobeGuvT,
708119489313951744,2016-03-11 02:36:57,Twitter for iPhone,This is Cooper. He basks in the glory of rebellion. 9/10 probably a preteen ,9.0,10,Cooper,2937,1102,Norwich terrier,https://t.co/kDamUfeIpm,
708109389455101952,2016-03-11 01:56:49,Twitter for iPhone,This is Remington. He was caught off guard by the magical floating cheese. Spooked af. 10/10 deep breaths pup ,10.0,10,Remington,2124,610,Staffordshire bullterrier,https://t.co/mhPSADiJmZ,
708026248782585858,2016-03-10 20:26:26,Twitter for iPhone,Everybody stop what you're doing and watch this video. Frank is stuck in a loop. 13/10 (Vid by @klbmatty) ,13.0,10,,4799,2166,malinois,https://t.co/5AJs8TIV1U,
707995814724026368,2016-03-10 18:25:30,Twitter for iPhone,This is Farfle. He lost his back legs during the Battle of Gettysburg. Goes 0-60 in 4.3 seconds (damn) 12/10 hero af ,12.0,10,Farfle,3385,1273,,https://t.co/NiQQWzIzzq,
707969809498152960,2016-03-10 16:42:10,Twitter for iPhone,Meet Rufus. He's a Honeysuckle Firefox. Curly af. Badass tie. About to go on his first date ever 11/10 good luck pup ,11.0,10,Rufus,2941,1097,toy poodle,https://t.co/dGoTWNfIsm,
707776935007539200,2016-03-10 03:55:45,Twitter for iPhone,This is Sadie. She's a Bohemian Rhapsody. Remarkably portable. Could sneak on roller coasters with (probably). 11/10 ,11.0,10,Sadie,3593,1079,miniature pinscher,https://t.co/DB8fyeDs8B,
707741517457260545,2016-03-10 01:35:01,Twitter for iPhone,When your roommate eats your leftover Chili's but you pretend it's no big deal cuz you fat anyway. 10/10 head up pup ,10.0,10,,2718,696,whippet,https://t.co/0nMgoue8IR,
707693576495472641,2016-03-09 22:24:31,Twitter for iPhone,This is Jiminus. He's in a tub for some reason. What a jokester. Smh 7/10 churlish af ,7.0,10,Jiminus,3765,1133,,https://t.co/84L4ED9Tpi,
707610948723478529,2016-03-09 16:56:11,Twitter for iPhone,This is Harper. She scraped her elbow attempting a backflip off a tree. Valiant effort tho. 12/10 ,12.0,10,Harper,18557,7236,golden retriever,https://t.co/oHKJHghrp5,
707420581654872064,2016-03-09 04:19:44,Twitter for iPhone,This is Keurig. He's a rare dog. Laughs like an idiot tho. Head is basically a weapon. Poorly maintained goatee 4/10 ,4.0,10,Keurig,2499,789,kuvasz,https://t.co/xOrUyj7K30,
707411934438625280,2016-03-09 03:45:22,Twitter for iPhone,"""I shall trip the big pupper with leash. Big pupper will never see it coming. I am a genius."" Both 11/10 ",11.0,10,,2486,673,Lakeland terrier,https://t.co/uQsCJ8pf51,pupper
707387676719185920,2016-03-09 02:08:59,Twitter for iPhone,Meet Clarkus. He's a Skinny Eastern Worcestershire. Can tie own shoes (impressive af) 10/10 would put on track team ,10.0,10,Clarkus,3835,1490,Chihuahua,https://t.co/XP5o7zGn0E,
707377100785885184,2016-03-09 01:26:57,Twitter for iPhone,This dog just brutally murdered a snowman. Currently toying with its nutritious remains 9/10 would totally still pet ,9.0,10,,3603,1214,golden retriever,https://t.co/iKThgKnW1j,
707315916783140866,2016-03-08 21:23:50,Twitter for iPhone,This is Finnegus. He's trapped in a snow globe. Poor pupper. 10/10 would make sure no one shook it ,10.0,10,Finnegus,2698,727,Bernese mountain dog,https://t.co/BjpOa52jQ4,pupper
707297311098011648,2016-03-08 20:09:54,Twitter for iPhone,This is Cassie. She can go from sweet to scary af in a matter of seconds. 10/10 points deducted for cats on pajamas ,10.0,10,Cassie,3022,903,Blenheim spaniel,https://t.co/B6dmZmJBdK,
707059547140169728,2016-03-08 04:25:07,Twitter for iPhone,Say hello to Cupcake. She's an Icelandic Dippen Dot. Confused by the oddly geometric lawn pattern. 11/10 ,11.0,10,Cupcake,2796,759,Samoyed,https://t.co/D7rorf4YKL,
707038192327901184,2016-03-08 03:00:15,Twitter for iPhone,This is Kathmandu. He sees every move you make. Probably knows Jiu-Jitsu. 10/10 mysterious af ,10.0,10,Kathmandu,2404,900,pug,https://t.co/z0cs7E4Xjj,
707021089608753152,2016-03-08 01:52:18,Twitter for iPhone,This is Tucker. He's a Dasani Episcopalian. Good lord what a tongue. 12/10 would never let go of ,12.0,10,Tucker,4433,1540,cocker spaniel,https://t.co/gHtW5cgyy7,
707014260413456384,2016-03-08 01:25:10,Twitter for iPhone,This is Ellie. She requests to be carried around in a lacrosse stick at all times. 11/10 impossible to say no ,11.0,10,Ellie,2502,664,Chihuahua,https://t.co/15yCmd43zU,
706901761596989440,2016-03-07 17:58:08,Twitter for iPhone,This is Elliot. He's blocking the roadway. Downright rude as hell. Doesn't care that you're already late. 3/10 ,3.0,10,Elliot,2264,680,,https://t.co/FMUxir5pYu,
706681918348251136,2016-03-07 03:24:33,Twitter for iPhone,Say hello to Katie. She's a Mitsubishi Hufflepuff. Curly af. 12/10 I'd do terrible things to acquire such a pup ,12.0,10,Katie,3627,1103,toy poodle,https://t.co/CFPIcGcwJv,
706644897839910912,2016-03-07 00:57:27,Twitter for iPhone,Meet Shadow. She's tired of the responsibilities associated with being a dog. No longer strives to attain ball. 9/10 ,9.0,10,Shadow,2814,1224,Chihuahua,https://t.co/cdOkfEpjFw,
706593038911545345,2016-03-06 21:31:22,Twitter for iPhone,Here's a sneak peek of me on spring break. 10/10 so many tired pups these days ,10.0,10,,2363,718,,https://t.co/6aJrjKfNqX,
706538006853918722,2016-03-06 17:52:42,Twitter for iPhone,"This is Oliver (pronounced ""Ricardo""). He's a ship captain. Controls these treacherous waters. 11/10 would sail with ",11.0,10,Oliver,3778,1580,chow,https://t.co/bxjO45rXKd,
706516534877929472,2016-03-06 16:27:23,Twitter for iPhone,Please enjoy this pup in a cooler. Permanently ready for someone to throw a tennis ball his way. 12/10 ,12.0,10,,3404,1150,golden retriever,https://t.co/KUS0xl7XIp,
706346369204748288,2016-03-06 05:11:12,Twitter for iPhone,This is Koda. She's a Beneboom Cumberwiggle. 12/10 petable as hell ,12.0,10,Koda,3768,1035,Tibetan mastiff,https://t.co/VZV6oMJmU6,
706310011488698368,2016-03-06 02:46:44,Twitter for iPhone,Here's a very sleepy pupper. Thinks it's an airplane. 12/10 would snug for eternity ,12.0,10,,23443,9034,Pembroke,https://t.co/GGmcTIkBbf,pupper
706291001778950144,2016-03-06 01:31:11,Twitter for iPhone,When you're just relaxin and having a swell time but then remember you have to fill out the FAFSA ...11/10 ,11.0,10,,1861,522,Border terrier,https://t.co/qy33OBcexg,
706265994973601792,2016-03-05 23:51:49,Twitter for iPhone,"This is Kara. She's been trying to solve that thing for 3 days. ""I don't have thumbs,"" she said. 11/10 solid effort ",11.0,10,Kara,2979,1030,papillon,https://t.co/lA6a8GefrV,
706166467411222528,2016-03-05 17:16:20,Twitter for iPhone,This is Dexter. He's a shy pup. Doesn't bark much. Dreadful fetcher. Has rare sun allergy. 7/10 still petable ,7.0,10,Dexter,5636,1819,Samoyed,https://t.co/sA7P3JSqiv,
705975130514706432,2016-03-05 04:36:02,Twitter for iPhone,This is Adele. Her tongue flies out of her mouth at random. It's a debilitating illness. 10/10 stay strong pupper ,10.0,10,Adele,3397,842,Staffordshire bullterrier,https://t.co/cfn81n3FLO,pupper
705970349788291072,2016-03-05 04:17:02,Twitter for iPhone,This is Lucy. She's a Venetian Kerploof. Supposed to be navigating. Quite irresponsible. Fancy ass collar tho 12/10 ,12.0,10,Lucy,3440,1008,golden retriever,https://t.co/8tjnz1L8DI,
705898680587526145,2016-03-04 23:32:15,Twitter for iPhone,Meet Max. He's a Fallopian Cephalopuff. Eyes are magical af. Lil dandruff problem. No big deal 10/10 would still pet ,10.0,10,Max,2597,643,collie,https://t.co/c67nUjwmFs,
705591895322394625,2016-03-04 03:13:11,Twitter for iPhone,"""Ma'am, for the last time, I'm not authorized to make that type of transaction"" 11/10 ",11.0,10,,3475,1308,basenji,https://t.co/nPTBsdm3BF,
705475953783398401,2016-03-03 19:32:29,Twitter for iPhone,Say hello to Zara. She found a sandal and couldn't be happier. 12/10 great work ,12.0,10,Zara,3231,1045,golden retriever,https://t.co/zQUuVu812n,
705442520700944385,2016-03-03 17:19:38,Twitter for iPhone,This is Cooper. He only wakes up to switch gears. 12/10 helpful af ,12.0,10,Cooper,4877,1859,Great Pyrenees,https://t.co/EEIkAGVY64,
705428427625635840,2016-03-03 16:23:38,Twitter for iPhone,This is Ambrose. He's an Alfalfa Ballyhoo. Draws pistol fast af. Pretty much runs the frontier. 11/10 lethal pupper ,11.0,10,Ambrose,4188,1931,Chihuahua,https://t.co/ih6epBOxIA,pupper
705239209544720384,2016-03-03 03:51:44,Twitter for iPhone,This is Jimothy. He lost his body during the the Third Crusade (tragic). 11/10 heroic af tho ,11.0,10,Jimothy,3290,854,Chihuahua,https://t.co/wnsblfu7XE,
