tweet_id,timestamp,source,text,rating_numerator,rating_denominator,name,tweet_favorite_count,tweet_retweet_count,dog_breed,Posted Image's URL,dog_stage
892420643555336193,2017-08-01 16:23:56,Twitter for iPhone,This is Phineas. He's a mystical boy. Only ever appears in the hole of a donut. 13/10 ,13.0,10,Phineas,39467,8853,,https://t.co/MgUWQ76dJU,
892177421306343426,2017-08-01 00:17:27,Twitter for iPhone,"This is Tilly. She's just checking pup on you. Hopes you're doing ok. If not, she's available for pats, snugs, boops, the whole bit. 13/10 ",13.0,10,Tilly,33819,6514,Chihuahua,https://t.co/0Xxu71qeIV,
891815181378084864,2017-07-31 00:18:03,Twitter for iPhone,This is Archie. He is a rare Norwegian Pouncing Corgo. Lives in the tall grass. You never know when one may strike. 12/10 ,12.0,10,Archie,25461,4328,Chihuahua,https://t.co/wUnZnhtVJB,
891689557279858688,2017-07-30 15:58:51,Twitter for iPhone,This is Darla. She commenced a snooze mid meal. 13/10 happens to the best of us ,13.0,10,Darla,42908,8964,Labrador retriever,https://t.co/tD36da7qLQ,
891327558926688256,2017-07-29 16:00:24,Twitter for iPhone,"This is Franklin. He would like you to stop calling him ""cute."" He is a very fierce shark and should be respected as such. 12/10 #BarkWeek ",12.0,10,Franklin,41048,9774,basset,https://t.co/AtUZn91f7f,
891087950875897856,2017-07-29 00:08:17,Twitter for iPhone,Here we have a majestic great white breaching off South Africa's coast. Absolutely h*ckin breathtaking. 13/10 (IG: tucker_marlo) #BarkWeek ,13.0,10,,20562,3261,Chesapeake Bay retriever,https://t.co/kQ04fDDRmh,
890971913173991426,2017-07-28 16:27:12,Twitter for iPhone,"Meet Jax. He enjoys ice cream so much he gets nervous around it. 13/10 help Jax enjoy more things by clicking below

",13.0,10,Jax,12041,2158,Appenzeller,https://t.co/Zr4hWfAs1H,
890729181411237888,2017-07-28 00:22:40,Twitter for iPhone,When you watch your owner call another dog a good boy but then they turn back to you and say you're a great boy. 13/10 ,13.0,10,,56848,16716,Pomeranian,https://t.co/v0nONBcwxq,
890609185150312448,2017-07-27 16:25:51,Twitter for iPhone,This is Zoey. She doesn't want to be one of the scary sharks. Just wants to be a snuggly pettable boatpet. 13/10 #BarkWeek ,13.0,10,Zoey,28226,4429,Irish terrier,https://t.co/9TwLuAGH0b,
890240255349198849,2017-07-26 15:59:51,Twitter for iPhone,This is Cassie. She is a college pup. Studying international doggo communication and stick theory. 14/10 so elegant much sophisticate ,14.0,10,Cassie,32467,7711,Pembroke,https://t.co/t1bfwz5S2A,doggo
890006608113172480,2017-07-26 00:31:25,Twitter for iPhone,This is Koda. He is a South Australian deckshark. Deceptively deadly. Frighteningly majestic. 13/10 would risk a petting #BarkWeek ,13.0,10,Koda,31166,7624,Samoyed,https://t.co/dVPW0B0Mme,
889880896479866881,2017-07-25 16:11:53,Twitter for iPhone,This is Bruno. He is a service shark. Only gets out of the water to assist you. 13/10 terrifyingly good boy ,13.0,10,Bruno,28268,5156,French bulldog,https://t.co/u1XPQMl29g,
889665388333682689,2017-07-25 01:55:32,Twitter for iPhone,Here's a puppo that seems to be on the fence about something haha no but seriously someone help her. 13/10 ,13.0,10,,38818,8538,Pembroke,https://t.co/BxvuXk0UCm,puppo
889638837579907072,2017-07-25 00:10:02,Twitter for iPhone,This is Ted. He does his best. Sometimes that's not enough. But it's ok. 12/10 would assist ,12.0,10,Ted,27672,4735,French bulldog,https://t.co/f8dEDcrKSR,
889531135344209921,2017-07-24 17:02:04,Twitter for iPhone,This is Stuart. He's sporting his favorite fanny pack. Secretly filled with bones only. 13/10 puppared puppo #BarkWeek ,13.0,10,Stuart,15359,2321,golden retriever,https://t.co/y70o6h3isq,puppo
889278841981685760,2017-07-24 00:19:32,Twitter for iPhone,This is Oliver. You're witnessing one of his many brutal attacks. Seems to be playing with his victim. 13/10 fr*ckin frightening #BarkWeek ,13.0,10,Oliver,25652,5637,whippet,https://t.co/WpHvrQedPb,
888917238123831296,2017-07-23 00:22:39,Twitter for iPhone,This is Jim. He found a fren. Taught him how to sit like the good boys. 12/10 for both ,12.0,10,Jim,29611,4709,golden retriever,https://t.co/chxruIOUJN,
888804989199671297,2017-07-22 16:56:37,Twitter for iPhone,This is Zeke. He has a new stick. Very proud of it. Would like you to throw it for him without taking it. 13/10 would do my best ,13.0,10,Zeke,26080,4559,golden retriever,https://t.co/HTQ77yNQ5K,
888554962724278272,2017-07-22 00:23:06,Twitter for iPhone,This is Ralphus. He's powering up. Attempting maximum borkdrive. 13/10 inspirational af ,13.0,10,Ralphus,20290,3732,Siberian husky,https://t.co/YnYAFCTTiK,
888078434458587136,2017-07-20 16:49:33,Twitter for iPhone,This is Gerald. He was just told he didn't get the job he interviewed for. A h*ckin injustice. 12/10 didn't want the job anyway ,12.0,10,Gerald,22201,3653,French bulldog,https://t.co/DK7iDPfuRX,
887705289381826560,2017-07-19 16:06:48,Twitter for iPhone,This is Jeffrey. He has a monopoly on the pool noodles. Currently running a 'boop for two' midweek sale. 13/10 h*ckin strategic ,13.0,10,Jeffrey,30779,5609,basset,https://t.co/PhrUk20Q64,
887517139158093824,2017-07-19 03:39:09,Twitter for iPhone,I've yet to rate a Venezuelan Hover Wiener. This is such an honor. 14/10 paw-inspiring af (IG: roxy.thedoxy) ,14.0,10,,46959,12082,,https://t.co/20VrLAA8ba,
887473957103951883,2017-07-19 00:47:34,Twitter for iPhone,This is Canela. She attempted some fancy porch pics. They were unsuccessful. 13/10 someone help her ,13.0,10,Canela,69871,18781,Pembroke,https://t.co/cLyzpcUcMX,
887343217045368832,2017-07-18 16:08:03,Twitter for iPhone,You may not have known you needed to see this today. 13/10 please enjoy (IG: emmylouroo) ,13.0,10,,34222,10737,Mexican hairless,https://t.co/WZqNqygEyV,
887101392804085760,2017-07-18 00:07:08,Twitter for iPhone,This... is a Jubilant Antarctic House Bear. We only rate dogs. Please only send dogs. Thank you... 12/10 would suffocate in floof ,12.0,10,,31061,6167,Samoyed,https://t.co/4Ad1jzJSdp,
886983233522544640,2017-07-17 16:17:36,Twitter for iPhone,This is Maya. She's very shy. Rarely leaves her cup. 13/10 would find her an environment to thrive in ,13.0,10,Maya,35859,8084,Chihuahua,https://t.co/I6oNy0CgiT,
886736880519319552,2017-07-16 23:58:41,Twitter for iPhone,"This is Mingus. He's a wonderful father to his smol pup. Confirmed 13/10, but he needs your help

",13.0,10,Mingus,12306,3443,kuvasz,https://t.co/bVi0Yr4Cff,
886680336477933568,2017-07-16 20:14:00,Twitter for iPhone,This is Derek. He's late for a dog meeting. 13/10 pet...al to the metal ,13.0,10,Derek,22798,4610,,https://t.co/BCoWue0abA,
886366144734445568,2017-07-15 23:25:31,Twitter for iPhone,This is Roscoe. Another pupper fallen victim to spontaneous tongue ejections. Get the BlepiPen immediate. 12/10 deep breaths Roscoe ,12.0,10,Roscoe,21524,3316,French bulldog,https://t.co/RGE08MIJox,pupper
886258384151887873,2017-07-15 16:17:19,Twitter for iPhone,This is Waffles. His doggles are pupside down. Unsure how to fix. 13/10 someone assist Waffles ,13.0,10,Waffles,28469,6523,pug,https://t.co/xZDA9Qsq1O,
885984800019947520,2017-07-14 22:10:11,Twitter for iPhone,Viewer discretion advised. This is Jimbo. He will rip ur finger right h*ckin off. Other dog clearly an accessory. 12/10 pls pet with caution ,12.0,10,Jimbo,33382,7097,Blenheim spaniel,https://t.co/BuveP0uMF1,
885528943205470208,2017-07-13 15:58:47,Twitter for iPhone,This is Maisey. She fell asleep mid-excavation. Happens to the best of us. 13/10 would pat noggin approvingly ,13.0,10,Maisey,36689,6683,pug,https://t.co/tp1kQ8i9JF,
885167619883638784,2017-07-12 16:03:00,Twitter for iPhone,Here we have a corgi undercover as a malamute. Pawbably doing important investigative work. Zero control over tongue happenings. 13/10 ,13.0,10,,22367,4556,malamute,https://t.co/44ItaMubBf,
884925521741709313,2017-07-12 00:01:00,Twitter for iPhone,"This is Earl. He found a hat. Nervous about what you think of it. 12/10 it's delightful, Earl ",12.0,10,Earl,68152,16439,Italian greyhound,https://t.co/MYJvdlNRVa,
884876753390489601,2017-07-11 20:47:12,Twitter for iPhone,This is Lola. It's her first time outside. Must test the earth and taste the atmosphere. 13/10 you're doing great Lola ,13.0,10,Lola,28514,6096,chow,https://t.co/74TKAUsLkO,
884562892145688576,2017-07-11 00:00:02,Twitter for iPhone,This is Kevin. He's just so happy. 13/10 what is your secret Kevin ,13.0,10,Kevin,24765,5100,pug,https://t.co/1r4MFCbCX5,
884441805382717440,2017-07-10 15:58:53,Twitter for iPhone,"I present to you, Pup in Hat. Pup in Hat is great for all occasions. Extremely versatile. Compact as h*ck. 14/10 (IG: itselizabethgales) ",14.0,10,,27478,5856,Pembroke,https://t.co/vvBOcC2VdC,
884162670584377345,2017-07-09 21:29:42,Twitter for iPhone,Meet Yogi. He doesn't have any important dog meetings today he just enjoys looking his best at all times. 12/10 for dangerously dapper doggo ,12.0,10,Yogi,20771,3128,German shepherd,https://t.co/YSI00BzTBZ,doggo
883838122936631299,2017-07-09 00:00:04,Twitter for iPhone,This is Noah. He can't believe someone made this mess. Got the vacuum out for you though. Offered to help clean pup. 12/10 super good boy ,12.0,10,Noah,22349,3586,Doberman,https://t.co/V85xujjDDY,
883482846933004288,2017-07-08 00:28:19,Twitter for iPhone,"This is Bella. She hopes her smile made you smile. If not, she is also offering you her favorite monkey. 13.5/10 ",13.5,10,Bella,46860,10407,golden retriever,https://t.co/qjrljjt948,
883360690899218434,2017-07-07 16:22:55,Twitter for iPhone,Meet Grizzwald. He may be the floofiest floofer I ever did see. Lost eyes saving a schoolbus from a volcano erpuption. 13/10 heroic as h*ck ,13.0,10,Grizzwald,22986,3825,chow,https://t.co/rf661IFEYP,floofer
883117836046086144,2017-07-07 00:17:54,Twitter for iPhone,"Please only send dogs. We don't rate mechanics, no matter how h*ckin good. Thank you... 13/10 would sneak a pat ",13.0,10,,37914,6949,golden retriever,https://t.co/Se5fZ9wp5E,
882992080364220416,2017-07-06 15:58:11,Twitter for iPhone,This is Rusty. He wasn't ready for the first pic. Clearly puppared for the second. 13/10 confirmed great boy ,13.0,10,Rusty,24445,4122,Eskimo dog,https://t.co/tyER0KpdXj,
882762694511734784,2017-07-06 00:46:41,Twitter for iPhone,This is Gus. He's quite the cheeky pupper. Already perfected the disinterested wink. 12/10 would let steal my girl ,12.0,10,Gus,28903,5134,Labrador retriever,https://t.co/D43I96SlVu,pupper
882627270321602560,2017-07-05 15:48:34,Twitter for iPhone,This is Stanley. He has his first swim lesson today. Doggle straps adjusted. Ready to go. 13/10 Phelps is nervous (IG: stanleythe_corgi) ,13.0,10,Stanley,28382,6342,Pembroke,https://t.co/Nx52PGwH94,
882268110199369728,2017-07-04 16:01:23,Twitter for iPhone,This is Alfy. You're witnessing his first watermelon experience. I think it was a success. 13/10 happy 4th Alfy ðŸ‡ºðŸ‡¸ ,13.0,10,Alfy,45880,12118,golden retriever,https://t.co/fYP5RlutfA,
882045870035918850,2017-07-04 01:18:17,Twitter for iPhone,"This is Koko. Her owner, inspired by Barney, recently built a cart for her to use during walks if she got tired. 13/10 rest easy Koko ",13.0,10,Koko,29900,5203,golden retriever,https://t.co/zeDpnsKX7w,
881906580714921986,2017-07-03 16:04:48,Twitter for iPhone,This is Rey. He's a Benebop Cumberfloof. 12/10 dangerously pettable ,12.0,10,Rey,24773,3533,Weimaraner,https://t.co/503CgWbhxQ,
881666595344535552,2017-07-03 00:11:11,Twitter for iPhone,This is Gary. He couldn't miss this puppertunity for a selfie. Flawless focusing skills. 13/10 would boop intensely ,13.0,10,Gary,51522,11099,Saluki,https://t.co/7CSWCl8I6s,
881536004380872706,2017-07-02 15:32:16,Twitter for iPhone,"Here is a pupper approaching maximum borkdrive. Zooming at never before seen speeds. 14/10 paw-inspiring af 
(IG: puffie_the_chow) ",14.0,10,,50199,16570,Samoyed,https://t.co/ghXBIIeQZF,pupper
881268444196462592,2017-07-01 21:49:04,Twitter for iPhone,Meet Elliot. He's a Canadian Forrest Pup. Unusual number of antlers for a dog. Sneaky tongue slip to celebrate #Canada150. 12/10 would pet ,12.0,10,Elliot,23501,5358,,https://t.co/cgwJwowTMC,
880935762899988482,2017-06-30 23:47:07,Twitter for iPhone,This is Louis. He's crossing. It's a big deal. 13/10 h*ckin breathtaking ,13.0,10,Louis,17346,2886,,https://t.co/D0wb1GlKAt,
880872448815771648,2017-06-30 19:35:32,Twitter for iPhone,Ugh not again. We only rate dogs. Please don't send in well-dressed  floppy-tongued street penguins. Dogs only please. Thank you... 12/10 ,12.0,10,,21734,3989,Pembroke,https://t.co/WiAMbTkDPf,
880465832366813184,2017-06-29 16:39:47,Twitter for iPhone,This is Bella. She had her first beach experience this morning. Complete success. 12/10 would perform a sandy boop ,12.0,10,Bella,29075,6546,golden retriever,https://t.co/4VsFysDmiw,
880221127280381952,2017-06-29 00:27:25,Twitter for iPhone,Meet Jesse. He's a Fetty Woof. His tongue ejects without warning. A true bleptomaniac. 12/10 would snug well ,12.0,10,Jesse,27640,4436,Chihuahua,https://t.co/fUod0tVmvK,
880095782870896641,2017-06-28 16:09:20,Twitter for iPhone,Please don't send in photos without dogs in them. We're not @porch_rates. Insubordinate and churlish. Pretty good porch tho 11/10 ,11.0,10,,28150,4533,miniature pinscher,https://t.co/HauE8M3Bu4,
879862464715927552,2017-06-28 00:42:13,Twitter for iPhone,This is Romeo. He would like to do an entrance. Requesting your immediate assistance. 13/10 ,13.0,10,Romeo,22667,3642,basset,https://t.co/Qh5aEkRQm9,
879492040517615616,2017-06-27 00:10:17,Twitter for iPhone,This is Bailey. He thinks you should measure ear length for signs of growth instead. 12/10 ,12.0,10,Bailey,23822,3323,German short-haired pointer,https://t.co/IxM9IMKQq8,
879415818425184262,2017-06-26 19:07:24,Twitter for iPhone,This is Duddles. He did an attempt. 13/10 someone help him (vid by Georgia Felici) ,13.0,10,Duddles,107956,45849,English springer,https://t.co/UDT7ZkcTgY,
879376492567855104,2017-06-26 16:31:08,Twitter for iPhone,This is Jack AKA Stephen Furry. You're not scoring on him. Unless he slips down the slide. 12/10 would happily get blocked by ,12.0,10,Jack,17099,3261,Labrador retriever,https://t.co/0gOi601EAa,
879050749262655488,2017-06-25 18:56:45,Twitter for iPhone,This is Steven. He has trouble relating to other dogs. Quite shy. Neck longer than average. Tropical probably. 11/10 would still pet ,11.0,10,Steven,23022,4941,,https://t.co/2mJCDEJWdD,
879008229531029506,2017-06-25 16:07:47,Twitter for iPhone,This is Beau. That is Beau's balloon. He takes it everywhere. 13/10 would protect at all costs ,13.0,10,Beau,19317,2812,vizsla,https://t.co/YDtpCjIPKN,
878776093423087618,2017-06-25 00:45:22,Twitter for iPhone,This is Snoopy. He's a proud #PrideMonthPuppo. Impeccable handwriting for not having thumbs. 13/10 would love back #PrideMonth ,13.0,10,Snoopy,19763,4319,Italian greyhound,https://t.co/lNZwgNO4gS,puppo
878281511006478336,2017-06-23 16:00:04,Twitter for iPhone,"Meet Shadow. In an attempt to reach maximum zooming borkdrive, he tore his ACL. Still 13/10 tho. Help him out below

",13.0,10,Shadow,7913,1349,basset,https://t.co/245xJJElsY,
878057613040115712,2017-06-23 01:10:23,Twitter for iPhone,This is Emmy. She was adopted today. Massive round of pupplause for Emmy and her new family. 14/10 for all involved ,14.0,10,Emmy,42876,7181,French bulldog,https://t.co/cwtWnHMVpe,
877736472329191424,2017-06-22 03:54:17,Twitter for iPhone,This is Aja. She was just told she's a good dog. Suspicions confirmed. 13/10 would tell again ,13.0,10,Aja,71144,17300,Chesapeake Bay retriever,https://t.co/lsPyyAiF1r,
877556246731214848,2017-06-21 15:58:08,Twitter for iPhone,This is Penny. She's both pupset and fired pup. Not pleased w your barbaric attempts at cleanliness. 12/10 would enjoy more shampoo options ,12.0,10,Penny,23258,3994,basset,https://t.co/OYdDlfOGXP,
877316821321428993,2017-06-21 00:06:44,Twitter for iPhone,"Meet Dante. At first he wasn't a fan of his new raincoat, then he saw his reflection. H*ckin handsome. 13/10 for water resistant good boy ",13.0,10,Dante,27907,5414,Saluki,https://t.co/SHRTIo5pxc,
877201837425926144,2017-06-20 16:29:50,Twitter for iPhone,This is Nelly. He graduated with his dogtorate today. Wants to know if you're proud of him. 12/10 would give congratulatory boop ,12.0,10,Nelly,27755,5880,Pembroke,https://t.co/4g4cfj3P4Y,
876838120628539392,2017-06-19 16:24:33,Twitter for iPhone,This is Ginger. She's having a ruff Monday. Too many pupper things going on. H*ckin exhausting. 12/10 would snug passionately ,12.0,10,Ginger,21125,3506,bloodhound,https://t.co/j211oCDRs6,pupper
876484053909872640,2017-06-18 16:57:37,Twitter for iPhone,This is Benedict. He wants to thank you for this delightful urban walk. Hopes you know he loves you. 13/10 super duper good boy ,13.0,10,Benedict,19163,2511,golden retriever,https://t.co/26BXueUgbs,
876120275196170240,2017-06-17 16:52:05,Twitter for iPhone,"Meet Venti, a seemingly caffeinated puppoccino. She was just informed the weekend would include walks, pats and scritches. 13/10 much excite ",13.0,10,Venti,28490,4903,Bernese mountain dog,https://t.co/ejExJFq3ek,
875747767867523072,2017-06-16 16:11:53,Twitter for iPhone,"This is Goose. He's a womanizer. Cheeky as h*ck, but also deep. Tongue slip game on another level. 13/10 will steal your girl ",13.0,10,Goose,25773,4497,Labrador retriever,https://t.co/V2WlACRJCN,
875144289856114688,2017-06-15 00:13:52,Twitter for iPhone,Meet Nugget and Hank. Nugget took Hank's bone. Hank is wondering if you would please return it to him. Both 13/10 would not intervene ,13.0,10,Nugget,22185,5081,Siberian husky,https://t.co/ogith9ejNj,
875021211251597312,2017-06-14 16:04:48,Twitter for iPhone,Guys please stop sending pictures without any dogs in th- oh never mind hello excuse me sir. 12/10 stealthy as h*ck ,12.0,10,,26022,4922,West Highland white terrier,https://t.co/brCQoqc8AW,
874680097055178752,2017-06-13 17:29:20,Twitter for iPhone,Meet Cash. He hath acquired a stick. A very good stick tbh. 12/10 would pat head approvingly ,12.0,10,Cash,28439,4875,Labrador retriever,https://t.co/lZhtizkURD,
874296783580663808,2017-06-12 16:06:11,Twitter for iPhone,This is Jed. He may be the fanciest pupper in the game right now. Knows it too. 13/10 would sign modeling contract ,13.0,10,Jed,26651,4308,cocker spaniel,https://t.co/0YplNnSMEm,pupper
874057562936811520,2017-06-12 00:15:36,Twitter for iPhone,"I can't believe this keeps happening. This, is a birb taking a bath. We only rate dogs. Please only send dogs. Thank you... 12/10 ",12.0,10,,23134,4125,flat-coated retriever,https://t.co/pwY9PQhtP2,
874012996292530176,2017-06-11 21:18:31,Twitter for iPhone,"This is Sebastian. He can't see all the colors of the rainbow, but he can see that this flag makes his human happy. 13/10 #PrideMonth puppo ",13.0,10,Sebastian,35501,11007,Cardigan,https://t.co/XBE0evJZ6V,puppo
873580283840344065,2017-06-10 16:39:04,Twitter for iPhone,"We usually don't rate Deck-bound Saskatoon Black Bears, but this one is h*ckin flawless. Sneaky tongue slip too. 13/10 would hug firmly ",13.0,10,,24837,4143,Newfoundland,https://t.co/mNuMH9400n,
873213775632977920,2017-06-09 16:22:42,Twitter for iPhone,"This is Sierra. She's one precious pupper. Absolute 12/10. Been in and out of ICU her whole life. Help Sierra below

",12.0,10,Sierra,7467,1667,vizsla,https://t.co/Xp01EU3qyD,pupper
872967104147763200,2017-06-09 00:02:31,Twitter for iPhone,Here's a very large dog. He has a date later. Politely asked this water person to check if his breath is bad. 12/10 good to go doggo ,12.0,10,,28031,5669,Labrador retriever,https://t.co/EMYIdoblMR,doggo
872820683541237760,2017-06-08 14:20:41,Twitter for iPhone,"Here are my favorite #dogsatpollingstations 
Most voted for a more consistent walking schedule and to increase daily pats tenfold. All 13/10 ",13.0,10,,15029,3884,pug,https://t.co/17FVMl4VZ5,
872620804844003328,2017-06-08 01:06:27,Twitter for iPhone,This is Monkey. She's supporting owners everywhere with her fancy #PrideMonth bandana. 13/10 love is love is love... ,13.0,10,Monkey,21309,3911,cocker spaniel,https://t.co/lUcpnZDPz9,
872486979161796608,2017-06-07 16:14:40,Twitter for iPhone,We. Only. Rate. Dogs. Do not send in other things like this fluffy floor shark clearly ready to attack. Get it together guys... 12/10 ,12.0,10,,41606,9429,Pembroke,https://t.co/BZHiKx3FpQ,
872261713294495745,2017-06-07 01:19:32,Twitter for iPhone,This is Harry. His ears are activated one at a time. Incredibly rare to witness in person. Very special moment here. 13/10 blessed as h*ck ,13.0,10,Harry,35085,6649,Labrador retriever,https://t.co/ejHvGDfWoa,
872122724285648897,2017-06-06 16:07:15,Twitter for iPhone,This is Kody. He's a baller. Wishes he was a little bit taller. Double dribbles often. Still 12/10 would happily get dunked on ,12.0,10,Kody,35324,8549,pug,https://t.co/PKSpmiefwN,
871879754684805121,2017-06-06 00:01:46,Twitter for iPhone,Say hello to Lassie. She's celebrating #PrideMonth by being a splendid mix of astute and adorable. Proudly supupporting her owner. 13/10 ,13.0,10,Lassie,39090,11918,Shetland sheepdog,https://t.co/uK6PNyeh9w,
871762521631449091,2017-06-05 16:15:56,Twitter for iPhone,This is Rover. As part of pupper protocol he had to at least attempt to eat the plant. Confirmed not tasty. Needs peanut butter. 12/10 ,12.0,10,Rover,20787,3678,Labrador retriever,https://t.co/AiVljI6QCg,pupper
871515927908634625,2017-06-04 23:56:03,Twitter for iPhone,This is Napolean. He's a Raggedy East Nicaraguan Zoom Zoom. Runs on one leg. Built for deception. No eyes. Good with kids. 12/10 great doggo ,12.0,10,Napolean,20730,3628,komondor,https://t.co/PR7B7w1rUw,doggo
871032628920680449,2017-06-03 15:55:36,Twitter for iPhone,"This is Boomer. He's doing an advanced water takeoff. The opposite of Sully. Ears for control, mlem for style. 13/10 simply breathtaking ",13.0,10,Boomer,23255,3999,kelpie,https://t.co/noNpY2Laoo,
870804317367881728,2017-06-03 00:48:22,Twitter for iPhone,Real funny guys. Sending in a pic without a dog in it. Hilarious. We'll rate the rug tho because it's giving off a very good vibe. 11/10 ,11.0,10,,33791,6393,,https://t.co/GCD1JccCyi,
870656317836468226,2017-06-02 15:00:16,Twitter for iPhone,"This is Cody. He zoomed too aggressively and tore his ACL. Happens to the best of us. Still 13/10

Help Cody here: ",13.0,10,Cody,12819,2817,Pembroke,https://t.co/4hxnDOt1CV,
870374049280663552,2017-06-01 20:18:38,Twitter for iPhone,This is Zoey. She really likes the planet. Would hate to see willful ignorance and the denial of fairly elemental science destroy it. 13/10 ,13.0,10,Zoey,85011,27680,golden retriever,https://t.co/T1xlgaPujm,
870308999962521604,2017-06-01 16:00:09,Twitter for iPhone,"This is Rumble, but he's not ready to. Would rather fall asleep in his bath bucket. 13/10 would attempt a boop without waking ",13.0,10,Rumble,22453,4384,Greater Swiss Mountain dog,https://t.co/MVQCzrF1g9,
870063196459192321,2017-05-31 23:43:25,Twitter for iPhone,Meet Clifford. He's quite large. Also red. Good w kids. Somehow never steps on them. Massive poops very inconvenient. Still 14/10 would ride ,14.0,10,Clifford,37771,8840,,https://t.co/apVOyDgOju,
869772420881756160,2017-05-31 04:27:59,Twitter for iPhone,"This is Dewey (pronounced ""covfefe""). He's having a good walk. Arguably the best walk. 13/10 would snug softly ",13.0,10,Dewey,43710,10663,Pembroke,https://t.co/HciEaJkC4D,
869702957897576449,2017-05-30 23:51:58,Twitter for iPhone,Meet Stanley. He likes road trips. Will shift for you. One ear more effective than other. 13/10 we don't leave until you buckle pup Stanley ,13.0,10,Stanley,29116,6728,Pembroke,https://t.co/vmCu3PFCQq,
869596645499047938,2017-05-30 16:49:31,Twitter for iPhone,This is Scout. He just graduated. Officially a doggo now. Have fun with taxes and losing sight of your ambitions. 12/10 would throw cap for ,12.0,10,Scout,16476,3327,Chihuahua,https://t.co/DsA2hwXAJo,doggo
869227993411051520,2017-05-29 16:24:37,Twitter for iPhone,This is Gizmo. His favorite thing is standing pupright like a hooman. Sneaky tongue slip status achieved. 13/10 would boop well ,13.0,10,Gizmo,21112,4023,Pembroke,https://t.co/IoR3n1fiiQ,
868880397819494401,2017-05-28 17:23:24,Twitter for iPhone,This is Walter. He won't start hydrotherapy without his favorite floatie. 14/10 keep it pup Walter ,14.0,10,Walter,55098,12518,French bulldog,https://t.co/r28jFx9uyF,
868622495443632128,2017-05-28 00:18:35,Twitter for iPhone,Here's a h*ckin peaceful boy. Unbothered by the comings and goings. 13/10 please reveal your wise ways ,13.0,10,,28295,6275,Labrador retriever,https://t.co/yeaH8Ej5eM,
868552278524837888,2017-05-27 19:39:34,Twitter for iPhone,"Say hello to Cooper. His expression is the same wet or dry. Absolute 12/10 but Coop desperately requests your help

",12.0,10,Cooper,10539,2240,whippet,https://t.co/ZMTE4Mr69f,
867900495410671616,2017-05-26 00:29:37,Twitter for iPhone,"Unbelievable. We only rate dogs. Please don't send in non-canines like the ""I"" from Pixar's opening credits. Thank you... 12/10 ",12.0,10,,24964,4439,Labrador retriever,https://t.co/JMhDNv5wXZ,
867774946302451713,2017-05-25 16:10:44,Twitter for iPhone,Meet Harold.  He's h*ckin cooperative. 13/10 good work Harold ,13.0,10,Harold,35179,7788,Border collie,https://t.co/ZYg3NZGICa,
867421006826221569,2017-05-24 16:44:18,Twitter for iPhone,This is Shikha. She just watched you drop a skittle on the ground and still eat it. Could not be less impressed. 12/10 superior puppo ,12.0,10,Shikha,16755,2697,Eskimo dog,https://t.co/XZlZKd73go,puppo
867051520902168576,2017-05-23 16:16:06,Twitter for iPhone,"Oh my this spooked me up. We only rate dogs, not happy ghosts. Please send dogs only. It's a very simple premise. Thank you... 13/10 ",13.0,10,,33420,8425,Samoyed,https://t.co/M5Rz0R8SIQ,
